[
  {
    "Condition": "Diabetes",
    "DrugType": "Glucophage",
    "MedicationName": "Metformin",
    "DosagePerDay": "500 mg",
    "Instructions": "Take one 500 mg tablet once a day with dinner for 2 weeks.",
    "Days": 14,
    "DateStarted": "2010-01-02",
    "Excel Start Date": "1/2/10",
    "Excel End Date": "1/16/10",
    "DateEnded": "2010-01-16",
    "Provider": "Dr. Bradley",
    "Refills": 0,
    "FillStatus": "Filled",
    "Route": "Oral",
    "Frequency": "Daily",
    "OrderStatus": "Complete",
    "Pharmacy": "CVS Pharmacy, 528 Beaver St, Durham, NC 27705"
  },
  {
    "Condition": "Diabetes",
    "DrugType": "Glucophage",
    "MedicationName": "Metformin",
    "DosagePerDay": "1000 mg",
    "Instructions": "Take two 500 mg tablets, one with breakfast and one with dinner for a total of 1000 mg/day for 30 days.",
    "Days": 30,
    "DateStarted": "2010-01-17",
    "Excel Start Date": "1/17/10",
    "Excel End Date": "2/16/10",
    "DateEnded": "2010-02-16",
    "Provider": "Dr. Bradley",
    "Refills": 0,
    "FillStatus": "Filled",
    "Route": "Oral",
    "Frequency": "Daily",
    "OrderStatus": "Complete",
    "Pharmacy": "CVS Pharmacy, 528 Beaver St, Durham, NC 27705"
  },
  {
    "Condition": "Diabetes",
    "DrugType": "Glucophage",
    "MedicationName": "Metformin",
    "DosagePerDay": "1000 mg",
    "Instructions": "Take two 500 mg tablets, one with breakfast and one with dinner for a total of 1000 mg/day for 30 days.",
    "Days": 316,
    "DateStarted": "2010-02-17",
    "Excel Start Date": "2/17/10",
    "Excel End Date": "12/30/10",
    "DateEnded": "2010-12-30",
    "Provider": "Dr. Bradley",
    "Refills": 11,
    "FillStatus": "Filled",
    "Route": "Oral",
    "Frequency": "Daily",
    "OrderStatus": "Complete",
    "Pharmacy": "CVS Pharmacy, 528 Beaver St, Durham, NC 27705"
  },
  {
    "Condition": "Diabetes",
    "DrugType": "Glucophage",
    "MedicationName": "Metformin",
    "DosagePerDay": "1000 mg",
    "Instructions": "Take two 500 mg tablets, one with breakfast and one with dinner for a total of 1000 mg/day for 30 days.",
    "Days": 30,
    "DateStarted": "2010-12-31",
    "Excel Start Date": "12/31/10",
    "Excel End Date": "1/30/11",
    "DateEnded": "2011-01-30",
    "Provider": "Dr. Bradley",
    "Refills": 1,
    "FillStatus": "Filled",
    "Route": "Oral",
    "Frequency": "Daily",
    "OrderStatus": "Complete",
    "Pharmacy": "CVS Pharmacy, 528 Beaver St, Durham, NC 27705"
  },
  {
    "Condition": "Diabetes",
    "DrugType": "Glucophage",
    "MedicationName": "Metformin",
    "DosagePerDay": "1500 mg",
    "Instructions": "Take three 500 mg tablets, one with each meal, for a total of 1500 mg/day for 2 weeks.",
    "Days": 14,
    "DateStarted": "2011-01-30",
    "Excel Start Date": "1/30/11",
    "Excel End Date": "2/13/11",
    "DateEnded": "2011-02-13",
    "Provider": "Dr. Bradley",
    "Refills": 0,
    "FillStatus": "Filled",
    "Route": "Oral",
    "Frequency": "Daily",
    "OrderStatus": "Complete",
    "Pharmacy": "CVS Pharmacy, 528 Beaver St, Durham, NC 27705"
  },
  {
    "Condition": "Diabetes",
    "DrugType": "Glucophage",
    "MedicationName": "Metformin",
    "DosagePerDay": "1500 mg",
    "Instructions": "Take three 500 mg tablets, one with each meal, for a total of 1500 mg/day for 30 days.",
    "Days": 365,
    "DateStarted": "2011-02-13",
    "Excel Start Date": "2/13/11",
    "Excel End Date": "2/13/12",
    "DateEnded": "2012-02-13",
    "Provider": "Dr. Bradley",
    "Refills": 11,
    "FillStatus": "Filled",
    "Route": "Oral",
    "Frequency": "Daily",
    "OrderStatus": "Complete",
    "Pharmacy": "CVS Pharmacy, 528 Beaver St, Durham, NC 27705"
  },
  {
    "Condition": "Diabetes",
    "DrugType": "Glucophage",
    "MedicationName": "Metformin",
    "DosagePerDay": "1500 mg",
    "Instructions": "Take three 500 mg tablets, one with each meal, for a total of 1500 mg/day for 30 days.",
    "Days": 365,
    "DateStarted": "2012-02-14",
    "Excel Start Date": "2/14/12",
    "Excel End Date": "2/13/13",
    "DateEnded": "2013-02-13",
    "Provider": "Dr. Bradley",
    "Refills": 11,
    "FillStatus": "Filled",
    "Route": "Oral",
    "Frequency": "Daily",
    "OrderStatus": "Complete",
    "Pharmacy": "CVS Pharmacy, 528 Beaver St, Durham, NC 27705"
  },
  {
    "Condition": "Diabetes",
    "DrugType": "Glucophage",
    "MedicationName": "Metformin",
    "DosagePerDay": "1500 mg",
    "Instructions": "Take three 500 mg tablets, one with each meal, for a total of 1500 mg/day for 30 days.",
    "Days": 365,
    "DateStarted": "2013-02-14",
    "Excel Start Date": "2/14/13",
    "Excel End Date": "2/14/14",
    "DateEnded": "2014-02-14",
    "Provider": "Dr. Bradley",
    "Refills": 11,
    "FillStatus": "Filled",
    "Route": "Oral",
    "Frequency": "Daily",
    "OrderStatus": "Complete",
    "Pharmacy": "CVS Pharmacy, 528 Beaver St, Durham, NC 27705"
  },
  {
    "Condition": "Diabetes",
    "DrugType": "Glucophage",
    "MedicationName": "Metformin",
    "DosagePerDay": "2000 mg",
    "Instructions": "Take two 1000 mg tablets, one with breakfast and one with dinner for a total of 2000 mg/day for 2 weeks.",
    "Days": 365,
    "DateStarted": "2014-02-15",
    "Excel Start Date": "2/15/14",
    "Excel End Date": "2/15/15",
    "DateEnded": "2015-02-15",
    "Provider": "Dr. Bradley",
    "Refills": 11,
    "FillStatus": "Filled",
    "Route": "Oral",
    "Frequency": "Daily",
    "OrderStatus": "Complete",
    "Pharmacy": "CVS Pharmacy, 528 Beaver St, Durham, NC 27706"
  },
  {
    "Condition": "Diabetes",
    "DrugType": "Glucophage",
    "MedicationName": "Metformin",
    "DosagePerDay": "2000 mg",
    "Instructions": "Take two 1000 mg tablets, one with breakfast and one with dinner for a total of 2000 mg/day for 2 weeks.",
    "Days": 365,
    "DateStarted": "2015-02-15",
    "Excel Start Date": "2/15/15",
    "Excel End Date": "2/15/16",
    "DateEnded": "2016-02-15",
    "Provider": "Dr. Bradley",
    "Refills": 11,
    "FillStatus": "Filled",
    "Route": "Oral",
    "Frequency": "Daily",
    "OrderStatus": "Complete",
    "Pharmacy": "CVS Pharmacy, 528 Beaver St, Durham, NC 27706"
  },
  {
    "Condition": "Diabetes",
    "DrugType": "Glucophage",
    "MedicationName": "Metformin",
    "DosagePerDay": "2000 mg",
    "Instructions": "Take two 1000 mg tablets, one with breakfast and one with dinner for a total of 2000 mg/day for 2 weeks.",
    "Days": 365,
    "DateStarted": "2016-02-16",
    "Excel Start Date": "2/16/16",
    "Excel End Date": "2/15/17",
    "DateEnded": "2017-02-15",
    "Provider": "Dr. Bradley",
    "Refills": 11,
    "FillStatus": "Filled",
    "Route": "Oral",
    "Frequency": "Daily",
    "OrderStatus": "Complete",
    "Pharmacy": "CVS Pharmacy, 528 Beaver St, Durham, NC 27706"
  },
  {
    "Condition": "Gout",
    "DrugType": "XO-I",
    "MedicationName": "Allopurinol",
    "DosagePerDay": "100 mg",
    "Instructions": "Take one 100 mg tablet/day for 10 days.",
    "Days": 10,
    "DateStarted": "2004-02-18",
    "Excel Start Date": "2/18/04",
    "Excel End Date": "2/28/04",
    "DateEnded": "2004-02-28",
    "Provider": "Dr. Bradley",
    "Refills": 0,
    "FillStatus": "Filled",
    "Route": "Oral",
    "Frequency": "Daily",
    "OrderStatus": "Complete",
    "Pharmacy": "CVS Pharmacy, 528 Beaver St, Durham, NC 27705"
  },
  {
    "Condition": "Gout",
    "DrugType": "XO-I",
    "MedicationName": "Allopurinol",
    "DosagePerDay": "100 mg",
    "Instructions": "Take one 100 mg tablet/day for 30 days.",
    "Days": 90,
    "DateStarted": "2004-02-28",
    "Excel Start Date": "2/28/04",
    "Excel End Date": "5/28/04",
    "DateEnded": "2004-05-28",
    "Provider": "Dr. Bradley",
    "Refills": 2,
    "FillStatus": "Filled",
    "Route": "Oral",
    "Frequency": "Daily",
    "OrderStatus": "Complete",
    "Pharmacy": "CVS Pharmacy, 528 Beaver St, Durham, NC 27705"
  },
  {
    "Condition": "Gout",
    "DrugType": "XO-I",
    "MedicationName": "Allopurinol",
    "DosagePerDay": "100 mg",
    "Instructions": "Take one 100 mg tablet/day for 30 days.",
    "Days": 365,
    "DateStarted": "2004-05-30",
    "Excel Start Date": "5/30/04",
    "Excel End Date": "5/30/05",
    "DateEnded": "2005-05-30",
    "Provider": "Dr. Bradley",
    "Refills": 11,
    "FillStatus": "Filled",
    "Route": "Oral",
    "Frequency": "Daily",
    "OrderStatus": "Complete",
    "Pharmacy": "CVS Pharmacy, 528 Beaver St, Durham, NC 27705"
  },
  {
    "Condition": "Gout",
    "DrugType": "XO-I",
    "MedicationName": "Allopurinol",
    "DosagePerDay": "100 mg",
    "Instructions": "Take one 100 mg tablet/day for 30 days.",
    "Days": 365,
    "DateStarted": "2005-05-31",
    "Excel Start Date": "5/31/05",
    "Excel End Date": "5/31/06",
    "DateEnded": "2006-05-30",
    "Provider": "Dr. Bradley",
    "Refills": 11,
    "FillStatus": "Filled",
    "Route": "Oral",
    "Frequency": "Daily",
    "OrderStatus": "Complete",
    "Pharmacy": "CVS Pharmacy, 528 Beaver St, Durham, NC 27705"
  },
  {
    "Condition": "Gout",
    "DrugType": "XO-I",
    "MedicationName": "Allopurinol",
    "DosagePerDay": "100 mg",
    "Instructions": "Take one 100 mg tablet/day for 30 days.",
    "Days": 365,
    "DateStarted": "2006-05-31",
    "Excel Start Date": "5/31/06",
    "Excel End Date": "5/31/07",
    "DateEnded": "2007-05-31",
    "Provider": "Dr. Bradley",
    "Refills": 11,
    "FillStatus": "Filled",
    "Route": "Oral",
    "Frequency": "Daily",
    "OrderStatus": "Complete",
    "Pharmacy": "CVS Pharmacy, 528 Beaver St, Durham, NC 27705"
  },
  {
    "Condition": "Gout",
    "DrugType": "XO-I",
    "MedicationName": "Allopurinol",
    "DosagePerDay": "100 mg",
    "Instructions": "Take one 100 mg tablet/day for 30 days.",
    "Days": 365,
    "DateStarted": "2007-05-31",
    "Excel Start Date": "5/31/07",
    "Excel End Date": "5/30/08",
    "DateEnded": "2008-05-30",
    "Provider": "Dr. Bradley",
    "Refills": 11,
    "FillStatus": "Filled",
    "Route": "Oral",
    "Frequency": "Daily",
    "OrderStatus": "Complete",
    "Pharmacy": "CVS Pharmacy, 528 Beaver St, Durham, NC 27705"
  },
  {
    "Condition": "Gout",
    "DrugType": "XO-I",
    "MedicationName": "Allopurinol",
    "DosagePerDay": "100 mg",
    "Instructions": "Take one 100 mg tablet/day for 30 days.",
    "Days": 365,
    "DateStarted": "2008-05-31",
    "Excel Start Date": "5/31/08",
    "Excel End Date": "5/31/09",
    "DateEnded": "2009-05-31",
    "Provider": "Dr. Bradley",
    "Refills": 11,
    "FillStatus": "Filled",
    "Route": "Oral",
    "Frequency": "Daily",
    "OrderStatus": "Complete",
    "Pharmacy": "CVS Pharmacy, 528 Beaver St, Durham, NC 27705"
  },
  {
    "Condition": "Gout",
    "DrugType": "XO-I",
    "MedicationName": "Allopurinol",
    "DosagePerDay": "100 mg",
    "Instructions": "Take one 100 mg tablet/day for 30 days.",
    "Days": 365,
    "DateStarted": "2009-05-31",
    "Excel Start Date": "5/31/09",
    "Excel End Date": "5/31/10",
    "DateEnded": "2010-05-31",
    "Provider": "Dr. Bradley",
    "Refills": 11,
    "FillStatus": "Filled",
    "Route": "Oral",
    "Frequency": "Daily",
    "OrderStatus": "Complete",
    "Pharmacy": "CVS Pharmacy, 528 Beaver St, Durham, NC 27705"
  },
  {
    "Condition": "Gout",
    "DrugType": "XO-I",
    "MedicationName": "Allopurinol",
    "DosagePerDay": "100 mg",
    "Instructions": "Take one 100 mg tablet/day for 30 days.",
    "Days": 365,
    "DateStarted": "2010-05-31",
    "Excel Start Date": "5/31/10",
    "Excel End Date": "5/31/11",
    "DateEnded": "2011-05-31",
    "Provider": "Dr. Bradley",
    "Refills": 11,
    "FillStatus": "Filled",
    "Route": "Oral",
    "Frequency": "Daily",
    "OrderStatus": "Complete",
    "Pharmacy": "CVS Pharmacy, 528 Beaver St, Durham, NC 27705"
  },
  {
    "Condition": "Gout",
    "DrugType": "XO-I",
    "MedicationName": "Allopurinol",
    "DosagePerDay": "100 mg",
    "Instructions": "Take one 100 mg tablet/day for 30 days.",
    "Days": 365,
    "DateStarted": "2011-05-31",
    "Excel Start Date": "5/31/11",
    "Excel End Date": "5/30/12",
    "DateEnded": "2012-05-30",
    "Provider": "Dr. Bradley",
    "Refills": 11,
    "FillStatus": "Filled",
    "Route": "Oral",
    "Frequency": "Daily",
    "OrderStatus": "Complete",
    "Pharmacy": "CVS Pharmacy, 528 Beaver St, Durham, NC 27705"
  },
  {
    "Condition": "Gout",
    "DrugType": "XO-I",
    "MedicationName": "Allopurinol",
    "DosagePerDay": "100 mg",
    "Instructions": "Take one 100 mg tablet/day for 30 days.",
    "Days": 365,
    "DateStarted": "2012-05-31",
    "Excel Start Date": "5/31/12",
    "Excel End Date": "5/31/13",
    "DateEnded": "2013-05-30",
    "Provider": "Dr. Bradley",
    "Refills": 11,
    "FillStatus": "Filled",
    "Route": "Oral",
    "Frequency": "Daily",
    "OrderStatus": "Complete",
    "Pharmacy": "CVS Pharmacy, 528 Beaver St, Durham, NC 27705"
  },
  {
    "Condition": "Gout",
    "DrugType": "XO-I",
    "MedicationName": "Allopurinol",
    "DosagePerDay": "100 mg",
    "Instructions": "Take one 100 mg tablet/day for 30 days.",
    "Days": 365,
    "DateStarted": "2013-05-31",
    "Excel Start Date": "5/31/13",
    "Excel End Date": "5/31/14",
    "DateEnded": "2014-05-31",
    "Provider": "Dr. Bradley",
    "Refills": 11,
    "FillStatus": "Filled",
    "Route": "Oral",
    "Frequency": "Daily",
    "OrderStatus": "Complete",
    "Pharmacy": "CVS Pharmacy, 528 Beaver St, Durham, NC 27705"
  },
  {
    "Condition": "Gout",
    "DrugType": "XO-I",
    "MedicationName": "Allopurinol",
    "DosagePerDay": "100 mg",
    "Instructions": "Take one 100 mg tablet/day for 30 days.",
    "Days": 365,
    "DateStarted": "2014-05-31",
    "Excel Start Date": "5/31/14",
    "Excel End Date": "5/31/15",
    "DateEnded": "2015-05-31",
    "Provider": "Dr. Bradley",
    "Refills": 11,
    "FillStatus": "Filled",
    "Route": "Oral",
    "Frequency": "Daily",
    "OrderStatus": "Complete",
    "Pharmacy": "CVS Pharmacy, 528 Beaver St, Durham, NC 27705"
  },
  {
    "Condition": "Gout",
    "DrugType": "XO-I",
    "MedicationName": "Allopurinol",
    "DosagePerDay": "200 mg",
    "Instructions": "Take one 200 mg tablet/day for 30 days.",
    "Days": 180,
    "DateStarted": "2015-07-07",
    "Excel Start Date": "7/7/15",
    "Excel End Date": "1/3/16",
    "DateEnded": "2016-01-03",
    "Provider": "Dr. Emerman",
    "Refills": 5,
    "FillStatus": "Filled",
    "Route": "Oral",
    "Frequency": "Daily",
    "OrderStatus": "Complete",
    "Pharmacy": "CVS Pharmacy, 528 Beaver St, Durham, NC 27705"
  },
  {
    "Condition": "Gout",
    "DrugType": "XO-I",
    "MedicationName": "Allopurinol",
    "DosagePerDay": "200 mg",
    "Instructions": "Take one 200 mg tablet/day for 30 days.",
    "Days": 365,
    "DateStarted": "2016-01-08",
    "Excel Start Date": "1/8/16",
    "Excel End Date": "1/7/17",
    "DateEnded": "2017-01-07",
    "Provider": "Dr. Emerman",
    "Refills": 11,
    "FillStatus": "Not filled",
    "Route": "Oral",
    "Frequency": "Daily",
    "OrderStatus": "Complete",
    "Pharmacy": "CVS Pharmacy, 528 Beaver St, Durham, NC 27705"
  },
  {
    "Condition": "Gout",
    "DrugType": "NSAIDs",
    "MedicationName": "Naproxen",
    "DosagePerDay": "500 mg",
    "Instructions": "Take one 500 mg tablet/day for 10 days or until inflammation and pain are gone.",
    "Days": 10,
    "DateStarted": "1999-05-05",
    "Excel Start Date": "5/5/99",
    "Excel End Date": "5/15/99",
    "DateEnded": "1999-05-15",
    "Provider": "Dr. Montana",
    "Refills": 0,
    "FillStatus": "Filled",
    "Route": "Oral",
    "Frequency": "Daily",
    "OrderStatus": "Complete",
    "Pharmacy": "CVS Pharmacy, 528 Beaver St, Durham, NC 27705"
  },
  {
    "Condition": "Gout",
    "DrugType": "NSAIDs",
    "MedicationName": "Naproxen",
    "DosagePerDay": "500 mg",
    "Instructions": "Take one 500 mg tablet/day for 10 days or until inflammation and pain are gone.",
    "Days": 10,
    "DateStarted": "2004-02-18",
    "Excel Start Date": "2/18/04",
    "Excel End Date": "2/28/04",
    "DateEnded": "2004-02-28",
    "Provider": "Dr. Bradley",
    "Refills": 0,
    "FillStatus": "Filled",
    "Route": "Oral",
    "Frequency": "Daily",
    "OrderStatus": "Complete",
    "Pharmacy": "CVS Pharmacy, 528 Beaver St, Durham, NC 27705"
  },
  {
    "Condition": "Gout",
    "DrugType": "NSAIDs",
    "MedicationName": "Naproxen",
    "DosagePerDay": "500 mg",
    "Instructions": "Take one 500 mg tablet/day for 10 days or until inflammation and pain are gone.",
    "Days": 10,
    "DateStarted": "2014-07-07",
    "Excel Start Date": "7/7/14",
    "Excel End Date": "7/17/14",
    "DateEnded": "2014-07-17",
    "Provider": "Dr. Emerman",
    "Refills": 0,
    "FillStatus": "Filled",
    "Route": "Oral",
    "Frequency": "Daily",
    "OrderStatus": "Complete",
    "Pharmacy": "CVS Pharmacy, 528 Beaver St, Durham, NC 27705"
  },
  {
    "Condition": "Gout",
    "DrugType": "Alkaloid",
    "MedicationName": "Colchicine",
    "DosagePerDay": "1.8 mg",
    "Instructions": "Take 1.2 mg then 0.6 mg single dose 1 hour after first dose.",
    "Days": 1,
    "DateStarted": "1999-05-05",
    "Excel Start Date": "5/5/99",
    "Excel End Date": "5/6/99",
    "DateEnded": "1999-05-06",
    "Provider": "Dr. Montana",
    "Refills": 0,
    "FillStatus": "Filled",
    "Route": "Oral",
    "Frequency": "Daily",
    "OrderStatus": "Complete",
    "Pharmacy": "CVS Pharmacy, 528 Beaver St, Durham, NC 27705"
  },
  {
    "Condition": "Gout",
    "DrugType": "Alkaloid",
    "MedicationName": "Colchicine",
    "DosagePerDay": "1.8 mg",
    "Instructions": "Take 1.2 mg then 0.6 mg single dose 1 hour after first dose.",
    "Days": 1,
    "DateStarted": "2004-02-18",
    "Excel Start Date": "2/18/04",
    "Excel End Date": "2/19/04",
    "DateEnded": "2004-02-19",
    "Provider": "Dr. Bradley",
    "Refills": 0,
    "FillStatus": "Filled",
    "Route": "Oral",
    "Frequency": "Daily",
    "OrderStatus": "Complete",
    "Pharmacy": "CVS Pharmacy, 528 Beaver St, Durham, NC 27705"
  },
  {
    "Condition": "Gout",
    "DrugType": "Alkaloid",
    "MedicationName": "Colchicine",
    "DosagePerDay": "1.8 mg",
    "Instructions": "Take 1.2 mg then 0.6 mg single dose 1 hour after first dose.",
    "Days": 1,
    "DateStarted": "2014-07-07",
    "Excel Start Date": "7/7/14",
    "Excel End Date": "7/8/14",
    "DateEnded": "2014-07-08",
    "Provider": "Dr. Emerman",
    "Refills": 0,
    "FillStatus": "Filled",
    "Route": "Oral",
    "Frequency": "Daily",
    "OrderStatus": "Complete",
    "Pharmacy": "CVS Pharmacy, 528 Beaver St, Durham, NC 27705"
  },
  {
    "Condition": "Depression",
    "DrugType": "SSRI",
    "MedicationName": "Fluoxetine",
    "DosagePerDay": "20 mg",
    "Instructions": "Take one 20 mg tablet/day for 30 days.",
    "Days": 30,
    "DateStarted": "2000-03-25",
    "Excel Start Date": "3/25/00",
    "Excel End Date": "4/24/00",
    "DateEnded": "2000-04-24",
    "Provider": "Dr. Bradley",
    "Refills": 0,
    "FillStatus": "Filled",
    "Route": "Oral",
    "Frequency": "Daily",
    "OrderStatus": "Complete",
    "Pharmacy": "CVS Pharmacy, 528 Beaver St, Durham, NC 27705"
  },
  {
    "Condition": "Depression",
    "DrugType": "SSRI",
    "MedicationName": "Fluoxetine",
    "DosagePerDay": "40 mg",
    "Instructions": "Take two 20 mg tablets/day for a total of 40 mg/day for 30 days.",
    "Days": 30,
    "DateStarted": "2000-04-26",
    "Excel Start Date": "4/26/00",
    "Excel End Date": "5/26/00",
    "DateEnded": "2000-05-26",
    "Provider": "Dr. Bradley",
    "Refills": 0,
    "FillStatus": "Filled",
    "Route": "Oral",
    "Frequency": "Daily",
    "OrderStatus": "Complete",
    "Pharmacy": "CVS Pharmacy, 528 Beaver St, Durham, NC 27705"
  },
  {
    "Condition": "Depression",
    "DrugType": "SSRI",
    "MedicationName": "Fluoxetine",
    "DosagePerDay": "80 mg",
    "Instructions": "Take four 20 mg tablets/day for a total of 80 mg/day for 30 days.",
    "Days": 30,
    "DateStarted": "2000-05-27",
    "Excel Start Date": "5/27/00",
    "Excel End Date": "6/26/00",
    "DateEnded": "2000-06-26",
    "Provider": "Dr. Bradley",
    "Refills": 0,
    "FillStatus": "Filled",
    "Route": "Oral",
    "Frequency": "Daily",
    "OrderStatus": "Complete",
    "Pharmacy": "CVS Pharmacy, 528 Beaver St, Durham, NC 27705"
  },
  {
    "Condition": "Depression",
    "DrugType": "SSRI",
    "MedicationName": "Sertraline",
    "DosagePerDay": "50 mg",
    "Instructions": "Take one 50 mg tablet/day for 30 days.",
    "Days": 30,
    "DateStarted": "2000-06-28",
    "Excel Start Date": "6/28/00",
    "Excel End Date": "7/28/00",
    "DateEnded": "2000-07-28",
    "Provider": "Dr. Bradley",
    "Refills": 0,
    "FillStatus": "Filled",
    "Route": "Oral",
    "Frequency": "Daily",
    "OrderStatus": "Complete",
    "Pharmacy": "CVS Pharmacy, 528 Beaver St, Durham, NC 27705"
  },
  {
    "Condition": "Depression",
    "DrugType": "SSRI",
    "MedicationName": "Sertraline",
    "DosagePerDay": "100 mg",
    "Instructions": "Take two 50 mg tablets/day for a total of 100 mg/day for 30 days.",
    "Days": 30,
    "DateStarted": "2000-07-29",
    "Excel Start Date": "7/29/00",
    "Excel End Date": "8/28/00",
    "DateEnded": "2000-08-28",
    "Provider": "Dr. Bradley",
    "Refills": 0,
    "FillStatus": "Filled",
    "Route": "Oral",
    "Frequency": "Daily",
    "OrderStatus": "Complete",
    "Pharmacy": "CVS Pharmacy, 528 Beaver St, Durham, NC 27705"
  },
  {
    "Condition": "Depression",
    "DrugType": "SSRI",
    "MedicationName": "Sertraline",
    "DosagePerDay": "150 mg",
    "Instructions": "Take three 50 mg tablets/day for a total of 150 mg/day for 30 days.",
    "Days": 30,
    "DateStarted": "2000-08-31",
    "Excel Start Date": "8/31/00",
    "Excel End Date": "9/30/00",
    "DateEnded": "2000-09-30",
    "Provider": "Dr. Bradley",
    "Refills": 0,
    "FillStatus": "Filled",
    "Route": "Oral",
    "Frequency": "Daily",
    "OrderStatus": "Complete",
    "Pharmacy": "CVS Pharmacy, 528 Beaver St, Durham, NC 27705"
  },
  {
    "Condition": "Depression",
    "DrugType": "SSRI",
    "MedicationName": "Sertraline",
    "DosagePerDay": "200 mg",
    "Instructions": "Take four 50 mg tablets/day for a total of 200 mg/day for 30 days.",
    "Days": 30,
    "DateStarted": "2000-10-02",
    "Excel Start Date": "10/2/00",
    "Excel End Date": "11/1/00",
    "DateEnded": "2000-11-01",
    "Provider": "Dr. Bradley",
    "Refills": 0,
    "FillStatus": "Filled",
    "Route": "Oral",
    "Frequency": "Daily",
    "OrderStatus": "Complete",
    "Pharmacy": "CVS Pharmacy, 528 Beaver St, Durham, NC 27705"
  },
  {
    "Condition": "Depression",
    "DrugType": "SSRI",
    "MedicationName": "Sertraline",
    "DosagePerDay": "200 mg",
    "Instructions": "Take four 50mg tablets/day for a total of 200 mg/day for 30 days.",
    "Days": 365,
    "DateStarted": "2000-11-03",
    "Excel Start Date": "11/3/00",
    "Excel End Date": "11/3/01",
    "DateEnded": "2001-11-03",
    "Provider": "Dr. Bradley",
    "Refills": 11,
    "FillStatus": "Filled",
    "Route": "Oral",
    "Frequency": "Daily",
    "OrderStatus": "Complete",
    "Pharmacy": "CVS Pharmacy, 528 Beaver St, Durham, NC 27705"
  },
  {
    "Condition": "Depression",
    "DrugType": "SSRI",
    "MedicationName": "Sertraline",
    "DosagePerDay": "200 mg",
    "Instructions": "Take four 50mg tablets/day for a total of 200 mg/day for 30 days.",
    "Days": 30,
    "DateStarted": "2006-11-14",
    "Excel Start Date": "11/14/06",
    "Excel End Date": "12/14/06",
    "DateEnded": "2006-12-14",
    "Provider": "Dr. Bradley",
    "Refills": 0,
    "FillStatus": "Filled",
    "Route": "Oral",
    "Frequency": "Daily",
    "OrderStatus": "Complete",
    "Pharmacy": "CVS Pharmacy, 528 Beaver St, Durham, NC 27705"
  },
  {
    "Condition": "Depression",
    "DrugType": "SSRI",
    "MedicationName": "Sertraline",
    "DosagePerDay": "200 mg",
    "Instructions": "Take four 50mg tablets/day for a total of 200 mg/day for 30 days.",
    "Days": 365,
    "DateStarted": "2006-12-17",
    "Excel Start Date": "12/17/06",
    "Excel End Date": "12/17/07",
    "DateEnded": "2007-12-17",
    "Provider": "Dr. Bradley",
    "Refills": 11,
    "FillStatus": "Filled",
    "Route": "Oral",
    "Frequency": "Daily",
    "OrderStatus": "Complete",
    "Pharmacy": "CVS Pharmacy, 528 Beaver St, Durham, NC 27705"
  },
  {
    "Condition": "Depression",
    "DrugType": "SSRI",
    "MedicationName": "Sertraline",
    "DosagePerDay": "200 mg",
    "Instructions": "Take four 50mg tablets/day for a total of 200 mg/day for 30 days.",
    "Days": 365,
    "DateStarted": "2007-12-17",
    "Excel Start Date": "12/17/07",
    "Excel End Date": "12/16/08",
    "DateEnded": "2008-12-16",
    "Provider": "Dr. Bradley",
    "Refills": 11,
    "FillStatus": "Filled",
    "Route": "Oral",
    "Frequency": "Daily",
    "OrderStatus": "Complete",
    "Pharmacy": "CVS Pharmacy, 528 Beaver St, Durham, NC 27705"
  },
  {
    "Condition": "Depression",
    "DrugType": "SSRI",
    "MedicationName": "Sertraline",
    "DosagePerDay": "200 mg",
    "Instructions": "Take four 50mg tablets/day for a total of 200 mg/day for 30 days.",
    "Days": 365,
    "DateStarted": "2008-12-17",
    "Excel Start Date": "12/17/08",
    "Excel End Date": "12/17/09",
    "DateEnded": "2009-12-17",
    "Provider": "Dr. Bradley",
    "Refills": 11,
    "FillStatus": "Filled",
    "Route": "Oral",
    "Frequency": "Daily",
    "OrderStatus": "Complete",
    "Pharmacy": "CVS Pharmacy, 528 Beaver St, Durham, NC 27705"
  },
  {
    "Condition": "Depression",
    "DrugType": "SSRI",
    "MedicationName": "Sertraline",
    "DosagePerDay": "200 mg",
    "Instructions": "Take four 50mg tablets/day for a total of 200 mg/day for 30 days.",
    "Days": 365,
    "DateStarted": "2009-12-17",
    "Excel Start Date": "12/17/09",
    "Excel End Date": "12/17/10",
    "DateEnded": "2010-12-17",
    "Provider": "Dr. Bradley",
    "Refills": 11,
    "FillStatus": "Not filled",
    "Route": "Oral",
    "Frequency": "Daily",
    "OrderStatus": "Complete",
    "Pharmacy": "CVS Pharmacy, 528 Beaver St, Durham, NC 27705"
  },
  {
    "Condition": "Depression",
    "DrugType": "SSRI",
    "MedicationName": "Sertraline",
    "DosagePerDay": "200 mg",
    "Instructions": "Take four 50mg tablets/day for a total of 200 mg/day for 30 days.",
    "Days": 365,
    "DateStarted": "2010-12-17",
    "Excel Start Date": "12/17/10",
    "Excel End Date": "12/17/11",
    "DateEnded": "2011-12-17",
    "Provider": "Dr. Bradley",
    "Refills": 11,
    "FillStatus": "Filled",
    "Route": "Oral",
    "Frequency": "Daily",
    "OrderStatus": "Complete",
    "Pharmacy": "CVS Pharmacy, 528 Beaver St, Durham, NC 27705"
  },
  {
    "Condition": "Depression",
    "DrugType": "SSRI",
    "MedicationName": "Sertraline",
    "DosagePerDay": "200 mg",
    "Instructions": "Take four 50mg tablets/day for a total of 200 mg/day for 30 days.",
    "Days": 365,
    "DateStarted": "2011-12-17",
    "Excel Start Date": "12/17/11",
    "Excel End Date": "12/16/12",
    "DateEnded": "2012-12-16",
    "Provider": "Dr. Bradley",
    "Refills": 11,
    "FillStatus": "Filled",
    "Route": "Oral",
    "Frequency": "Daily",
    "OrderStatus": "Complete",
    "Pharmacy": "CVS Pharmacy, 528 Beaver St, Durham, NC 27705"
  },
  {
    "Condition": "Depression",
    "DrugType": "SSRI",
    "MedicationName": "Sertraline",
    "DosagePerDay": "200 mg",
    "Instructions": "Take four 50mg tablets/day for a total of 200 mg/day for 30 days.",
    "Days": 365,
    "DateStarted": "2012-12-17",
    "Excel Start Date": "12/17/12",
    "Excel End Date": "12/17/13",
    "DateEnded": "2013-12-17",
    "Provider": "Dr. Bradley",
    "Refills": 11,
    "FillStatus": "Filled",
    "Route": "Oral",
    "Frequency": "Daily",
    "OrderStatus": "Complete",
    "Pharmacy": "CVS Pharmacy, 528 Beaver St, Durham, NC 27705"
  },
  {
    "Condition": "Depression",
    "DrugType": "SSRI",
    "MedicationName": "Sertraline",
    "DosagePerDay": "200 mg",
    "Instructions": "Take four 50mg tablets/day for a total of 200 mg/day for 30 days.",
    "Days": 365,
    "DateStarted": "2013-12-17",
    "Excel Start Date": "12/17/13",
    "Excel End Date": "12/17/14",
    "DateEnded": "2014-12-17",
    "Provider": "Dr. Bradley",
    "Refills": 11,
    "FillStatus": "Filled",
    "Route": "Oral",
    "Frequency": "Daily",
    "OrderStatus": "Complete",
    "Pharmacy": "CVS Pharmacy, 528 Beaver St, Durham, NC 27705"
  },
  {
    "Condition": "Depression",
    "DrugType": "SSRI",
    "MedicationName": "Sertraline",
    "DosagePerDay": "200 mg",
    "Instructions": "Take four 50mg tablets/day for a total of 200 mg/day for 30 days.",
    "Days": 365,
    "DateStarted": "2014-12-17",
    "Excel Start Date": "12/17/14",
    "Excel End Date": "12/17/15",
    "DateEnded": "2015-12-17",
    "Provider": "Dr. Bradley",
    "Refills": 11,
    "FillStatus": "Filled",
    "Route": "Oral",
    "Frequency": "Daily",
    "OrderStatus": "Complete",
    "Pharmacy": "CVS Pharmacy, 528 Beaver St, Durham, NC 27705"
  },
  {
    "Condition": "Depression",
    "DrugType": "SSRI",
    "MedicationName": "Sertraline",
    "DosagePerDay": "200 mg",
    "Instructions": "Take four 50mg tablets/day for a total of 200 mg/day for 30 days.",
    "Days": 365,
    "DateStarted": "2015-12-17",
    "Excel Start Date": "12/17/15",
    "Excel End Date": "12/16/16",
    "DateEnded": "2016-12-16",
    "Provider": "Dr. Bradley",
    "Refills": 11,
    "FillStatus": "Filled",
    "Route": "Oral",
    "Frequency": "Daily",
    "OrderStatus": "Complete",
    "Pharmacy": "CVS Pharmacy, 528 Beaver St, Durham, NC 27705"
  },
  {
    "Condition": "Depression",
    "DrugType": "Atypical",
    "MedicationName": "Bupropion XR",
    "DosagePerDay": "150 mg",
    "Instructions": "Take one tablet of 150 mg in the morning each day, if tolerated, as early as day 4, increase to two tablets in the morning each day for a total of 300 mg/day for 30 days.",
    "Days": 30,
    "DateStarted": "2006-12-17",
    "Excel Start Date": "12/17/06",
    "Excel End Date": "1/16/07",
    "DateEnded": "2006-01-16",
    "Provider": "Dr. Bradley",
    "Refills": 0,
    "FillStatus": "Filled",
    "Route": "Oral",
    "Frequency": "Daily",
    "OrderStatus": "Complete",
    "Pharmacy": "CVS Pharmacy, 528 Beaver St, Durham, NC 27705"
  },
  {
    "Condition": "Depression",
    "DrugType": "Atypical",
    "MedicationName": "Bupropion XR",
    "DosagePerDay": "300 mg",
    "Instructions": "Take two tablets of 150 mg in the morning each day for a total of 300 mg/day for 30 days.",
    "Days": 30,
    "DateStarted": "2007-01-18",
    "Excel Start Date": "1/18/07",
    "Excel End Date": "2/17/07",
    "DateEnded": "2007-02-17",
    "Provider": "Dr. Bradley",
    "Refills": 0,
    "FillStatus": "Filled",
    "Route": "Oral",
    "Frequency": "Daily",
    "OrderStatus": "Complete",
    "Pharmacy": "CVS Pharmacy, 528 Beaver St, Durham, NC 27705"
  },
  {
    "Condition": "Depression",
    "DrugType": "Atypical",
    "MedicationName": "Bupropion XR",
    "DosagePerDay": "300 mg",
    "Instructions": "Take two tablets of 150 mg in the morning each day for a total of 300 mg/day for 30 days.",
    "Days": 365,
    "DateStarted": "2007-02-18",
    "Excel Start Date": "2/18/07",
    "Excel End Date": "2/18/08",
    "DateEnded": "2008-02-18",
    "Provider": "Dr. Bradley",
    "Refills": 11,
    "FillStatus": "Filled",
    "Route": "Oral",
    "Frequency": "Daily",
    "OrderStatus": "Complete",
    "Pharmacy": "CVS Pharmacy, 528 Beaver St, Durham, NC 27705"
  },
  {
    "Condition": "Depression",
    "DrugType": "Atypical",
    "MedicationName": "Bupropion XR",
    "DosagePerDay": "300 mg",
    "Instructions": "Take two tablets of 150 mg in the morning each day for a total of 300 mg/day for 30 days.",
    "Days": 365,
    "DateStarted": "2008-02-18",
    "Excel Start Date": "2/18/08",
    "Excel End Date": "2/17/09",
    "DateEnded": "2009-02-17",
    "Provider": "Dr. Bradley",
    "Refills": 11,
    "FillStatus": "Filled",
    "Route": "Oral",
    "Frequency": "Daily",
    "OrderStatus": "Complete",
    "Pharmacy": "CVS Pharmacy, 528 Beaver St, Durham, NC 27705"
  },
  {
    "Condition": "Depression",
    "DrugType": "Atypical",
    "MedicationName": "Bupropion XR",
    "DosagePerDay": "300 mg",
    "Instructions": "Take two tablets of 150 mg in the morning each day for a total of 300 mg/day for 30 days.",
    "Days": 365,
    "DateStarted": "2009-02-18",
    "Excel Start Date": "2/18/09",
    "Excel End Date": "2/18/10",
    "DateEnded": "2010-02-18",
    "Provider": "Dr. Bradley",
    "Refills": 11,
    "FillStatus": "Filled",
    "Route": "Oral",
    "Frequency": "Daily",
    "OrderStatus": "Complete",
    "Pharmacy": "CVS Pharmacy, 528 Beaver St, Durham, NC 27705"
  },
  {
    "Condition": "Depression",
    "DrugType": "Atypical",
    "MedicationName": "Bupropion XR",
    "DosagePerDay": "300 mg",
    "Instructions": "Take two tablets of 150 mg in the morning each day for a total of 300 mg/day for 30 days.",
    "Days": 365,
    "DateStarted": "2010-02-18",
    "Excel Start Date": "2/18/10",
    "Excel End Date": "2/18/11",
    "DateEnded": "2011-02-18",
    "Provider": "Dr. Bradley",
    "Refills": 11,
    "FillStatus": "Filled",
    "Route": "Oral",
    "Frequency": "Daily",
    "OrderStatus": "Complete",
    "Pharmacy": "CVS Pharmacy, 528 Beaver St, Durham, NC 27705"
  },
  {
    "Condition": "Depression",
    "DrugType": "Atypical",
    "MedicationName": "Bupropion XR",
    "DosagePerDay": "300 mg",
    "Instructions": "Take two tablets of 150 mg in the morning each day for a total of 300 mg/day for 30 days.",
    "Days": 365,
    "DateStarted": "2011-02-18",
    "Excel Start Date": "2/18/11",
    "Excel End Date": "2/18/12",
    "DateEnded": "2012-02-18",
    "Provider": "Dr. Bradley",
    "Refills": 11,
    "FillStatus": "Filled",
    "Route": "Oral",
    "Frequency": "Daily",
    "OrderStatus": "Complete",
    "Pharmacy": "CVS Pharmacy, 528 Beaver St, Durham, NC 27705"
  },
  {
    "Condition": "Depression",
    "DrugType": "Atypical",
    "MedicationName": "Bupropion XR",
    "DosagePerDay": "300 mg",
    "Instructions": "Take two tablets of 150 mg in the morning each day for a total of 300 mg/day for 30 days.",
    "Days": 365,
    "DateStarted": "2012-02-18",
    "Excel Start Date": "2/18/12",
    "Excel End Date": "2/17/13",
    "DateEnded": "2013-02-18",
    "Provider": "Dr. Bradley",
    "Refills": 11,
    "FillStatus": "Filled",
    "Route": "Oral",
    "Frequency": "Daily",
    "OrderStatus": "Complete",
    "Pharmacy": "CVS Pharmacy, 528 Beaver St, Durham, NC 27705"
  },
  {
    "Condition": "Depression",
    "DrugType": "Atypical",
    "MedicationName": "Bupropion XR",
    "DosagePerDay": "300 mg",
    "Instructions": "Take two tablets of 150 mg in the morning each day for a total of 300 mg/day for 30 days.",
    "Days": 365,
    "DateStarted": "2013-02-18",
    "Excel Start Date": "2/18/13",
    "Excel End Date": "2/18/14",
    "DateEnded": "2014-02-18",
    "Provider": "Dr. Bradley",
    "Refills": 11,
    "FillStatus": "Filled",
    "Route": "Oral",
    "Frequency": "Daily",
    "OrderStatus": "Complete",
    "Pharmacy": "CVS Pharmacy, 528 Beaver St, Durham, NC 27705"
  },
  {
    "Condition": "Depression",
    "DrugType": "Atypical",
    "MedicationName": "Bupropion XR",
    "DosagePerDay": "300 mg",
    "Instructions": "Take two tablets of 150 mg in the morning each day for a total of 300 mg/day for 30 days.",
    "Days": 365,
    "DateStarted": "2014-02-18",
    "Excel Start Date": "2/18/14",
    "Excel End Date": "2/18/15",
    "DateEnded": "2015-02-18",
    "Provider": "Dr. Bradley",
    "Refills": 11,
    "FillStatus": "Filled",
    "Route": "Oral",
    "Frequency": "Daily",
    "OrderStatus": "Complete",
    "Pharmacy": "CVS Pharmacy, 528 Beaver St, Durham, NC 27705"
  },
  {
    "Condition": "Depression",
    "DrugType": "Atypical",
    "MedicationName": "Bupropion XR",
    "DosagePerDay": "300 mg",
    "Instructions": "Take two tablets of 150 mg in the morning each day for a total of 300 mg/day for 30 days.",
    "Days": 365,
    "DateStarted": "2015-02-18",
    "Excel Start Date": "2/18/15",
    "Excel End Date": "2/18/16",
    "DateEnded": "2016-02-18",
    "Provider": "Dr. Bradley",
    "Refills": 11,
    "FillStatus": "Filled",
    "Route": "Oral",
    "Frequency": "Daily",
    "OrderStatus": "Active",
    "Pharmacy": "CVS Pharmacy, 528 Beaver St, Durham, NC 27705"
  },
  {
    "Condition": "Depression",
    "DrugType": "Atypical",
    "MedicationName": "Bupropion XR",
    "DosagePerDay": "300 mg",
    "Instructions": "Take two tablets of 150 mg in the morning each day for a total of 300 mg/day for 30 days.",
    "Days": 365,
    "DateStarted": "2016-02-18",
    "Excel Start Date": "2/18/16",
    "Excel End Date": "2/17/17",
    "DateEnded": "2017-02-17",
    "Provider": "Dr. Bradley",
    "Refills": 11,
    "FillStatus": "Filled",
    "Route": "Oral",
    "Frequency": "Daily",
    "OrderStatus": "Active",
    "Pharmacy": "CVS Pharmacy, 528 Beaver St, Durham, NC 27705"
  },
  {
    "Condition": "Hypertension",
    "DrugType": "Thiazide",
    "MedicationName": "Hydrochlorothiazide",
    "DosagePerDay": "12.5 mg",
    "Instructions": "Take one tablet of 12.5 mg/day for 2 weeks.",
    "Days": 14,
    "DateStarted": "1996-08-08",
    "Excel Start Date": "8/8/96",
    "Excel End Date": "8/22/96",
    "DateEnded": "1996-08-22",
    "Provider": "Dr. Bradley",
    "Refills": 0,
    "FillStatus": "Filled",
    "Route": "Oral",
    "Frequency": "Daily",
    "OrderStatus": "Complete",
    "Pharmacy": "CVS Pharmacy, 528 Beaver St, Durham, NC 27705"
  },
  {
    "Condition": "Hypertension",
    "DrugType": "Thiazide",
    "MedicationName": "Hydrochlorothiazide",
    "DosagePerDay": "12.5 mg",
    "Instructions": "Take one tablet of 12.5 mg/day for 30 days.",
    "Days": 365,
    "DateStarted": "1996-08-27",
    "Excel Start Date": "8/27/96",
    "Excel End Date": "8/27/97",
    "DateEnded": "1997-08-27",
    "Provider": "Dr. Bradley",
    "Refills": 11,
    "FillStatus": "Filled",
    "Route": "Oral",
    "Frequency": "Daily",
    "OrderStatus": "Complete",
    "Pharmacy": "CVS Pharmacy, 528 Beaver St, Durham, NC 27705"
  },
  {
    "Condition": "Hypertension",
    "DrugType": "Thiazide",
    "MedicationName": "Hydrochlorothiazide",
    "DosagePerDay": "12.5 mg",
    "Instructions": "Take one tablet of 12.5 mg/day for 30 days.",
    "Days": 365,
    "DateStarted": "1997-08-27",
    "Excel Start Date": "8/27/97",
    "Excel End Date": "8/27/98",
    "DateEnded": "1998-08-27",
    "Provider": "Dr. Bradley",
    "Refills": 11,
    "FillStatus": "Filled",
    "Route": "Oral",
    "Frequency": "Daily",
    "OrderStatus": "Complete",
    "Pharmacy": "CVS Pharmacy, 528 Beaver St, Durham, NC 27705"
  },
  {
    "Condition": "Hypertension",
    "DrugType": "Thiazide",
    "MedicationName": "Hydrochlorothiazide",
    "DosagePerDay": "25 mg",
    "Instructions": "Take one tablet of 25 mg/day for 2 weeks.",
    "Days": 14,
    "DateStarted": "1998-08-27",
    "Excel Start Date": "8/27/98",
    "Excel End Date": "9/10/98",
    "DateEnded": "1998-09-10",
    "Provider": "Dr. Bradley",
    "Refills": 0,
    "FillStatus": "Filled",
    "Route": "Oral",
    "Frequency": "Daily",
    "OrderStatus": "Complete",
    "Pharmacy": "CVS Pharmacy, 528 Beaver St, Durham, NC 27705"
  },
  {
    "Condition": "Hypertension",
    "DrugType": "Thiazide",
    "MedicationName": "Hydrochlorothiazide",
    "DosagePerDay": "25 mg",
    "Instructions": "Take one tablet of 25 mg/day for 30 days.",
    "Days": 365,
    "DateStarted": "1998-09-12",
    "Excel Start Date": "9/12/98",
    "Excel End Date": "9/12/99",
    "DateEnded": "1999-09-12",
    "Provider": "Dr. Bradley",
    "Refills": 11,
    "FillStatus": "Filled",
    "Route": "Oral",
    "Frequency": "Daily",
    "OrderStatus": "Complete",
    "Pharmacy": "CVS Pharmacy, 528 Beaver St, Durham, NC 27705"
  },
  {
    "Condition": "Hypertension",
    "DrugType": "Thiazide",
    "MedicationName": "Hydrochlorothiazide",
    "DosagePerDay": "25 mg",
    "Instructions": "Take one tablet of 25 mg/day for 30 days.",
    "Days": 365,
    "DateStarted": "1999-09-12",
    "Excel Start Date": "9/12/99",
    "Excel End Date": "9/11/00",
    "DateEnded": "2000-09-11",
    "Provider": "Dr. Bradley",
    "Refills": 11,
    "FillStatus": "Filled",
    "Route": "Oral",
    "Frequency": "Daily",
    "OrderStatus": "Complete",
    "Pharmacy": "CVS Pharmacy, 528 Beaver St, Durham, NC 27705"
  },
  {
    "Condition": "Hypertension",
    "DrugType": "Thiazide",
    "MedicationName": "Hydrochlorothiazide",
    "DosagePerDay": "25 mg",
    "Instructions": "Take one tablet of 25 mg/day for 30 days.",
    "Days": 365,
    "DateStarted": "2000-09-12",
    "Excel Start Date": "9/12/00",
    "Excel End Date": "9/12/01",
    "DateEnded": "2001-09-12",
    "Provider": "Dr. Bradley",
    "Refills": 11,
    "FillStatus": "Filled",
    "Route": "Oral",
    "Frequency": "Daily",
    "OrderStatus": "Complete",
    "Pharmacy": "CVS Pharmacy, 528 Beaver St, Durham, NC 27705"
  },
  {
    "Condition": "Hypertension",
    "DrugType": "Thiazide",
    "MedicationName": "Hydrochlorothiazide",
    "DosagePerDay": "50 mg",
    "Instructions": "Take one tablet of 50 mg/day for 30 days.",
    "Days": 365,
    "DateStarted": "2001-09-13",
    "Excel Start Date": "9/13/01",
    "Excel End Date": "9/13/02",
    "DateEnded": "2002-09-13",
    "Provider": "Dr. Bradley",
    "Refills": 11,
    "FillStatus": "Filled",
    "Route": "Oral",
    "Frequency": "Daily",
    "OrderStatus": "Complete",
    "Pharmacy": "CVS Pharmacy, 528 Beaver St, Durham, NC 27705"
  },
  {
    "Condition": "Hypertension",
    "DrugType": "Thiazide",
    "MedicationName": "Hydrochlorothiazide",
    "DosagePerDay": "50 mg",
    "Instructions": "Take one tablet of 50 mg/day for 30 days.",
    "Days": 365,
    "DateStarted": "2002-09-28",
    "Excel Start Date": "9/28/02",
    "Excel End Date": "9/28/03",
    "DateEnded": "2003-09-28",
    "Provider": "Dr. Bradley",
    "Refills": 11,
    "FillStatus": "Filled",
    "Route": "Oral",
    "Frequency": "Daily",
    "OrderStatus": "Complete",
    "Pharmacy": "CVS Pharmacy, 528 Beaver St, Durham, NC 27705"
  },
  {
    "Condition": "Hypertension",
    "DrugType": "Thiazide",
    "MedicationName": "Hydrochlorothiazide",
    "DosagePerDay": "50 mg",
    "Instructions": "Take one tablet of 50 mg/day for 30 days.",
    "Days": 365,
    "DateStarted": "2003-09-28",
    "Excel Start Date": "9/28/03",
    "Excel End Date": "9/27/04",
    "DateEnded": "2004-09-27",
    "Provider": "Dr. Bradley",
    "Refills": 11,
    "FillStatus": "Filled",
    "Route": "Oral",
    "Frequency": "Daily",
    "OrderStatus": "Complete",
    "Pharmacy": "CVS Pharmacy, 528 Beaver St, Durham, NC 27705"
  },
  {
    "Condition": "Hypertension",
    "DrugType": "Thiazide",
    "MedicationName": "Hydrochlorothiazide",
    "DosagePerDay": "50 mg",
    "Instructions": "Take one tablet of 50 mg/day for 30 days.",
    "Days": 365,
    "DateStarted": "2004-09-28",
    "Excel Start Date": "9/28/04",
    "Excel End Date": "9/28/05",
    "DateEnded": "2005-09-28",
    "Provider": "Dr. Bradley",
    "Refills": 11,
    "FillStatus": "Filled",
    "Route": "Oral",
    "Frequency": "Daily",
    "OrderStatus": "Complete",
    "Pharmacy": "CVS Pharmacy, 528 Beaver St, Durham, NC 27705"
  },
  {
    "Condition": "Hypertension",
    "DrugType": "Thiazide",
    "MedicationName": "Hydrochlorothiazide",
    "DosagePerDay": "50 mg",
    "Instructions": "Take one tablet of 50 mg/day for 30 days.",
    "Days": 365,
    "DateStarted": "2005-09-28",
    "Excel Start Date": "9/28/05",
    "Excel End Date": "9/28/06",
    "DateEnded": "2006-09-28",
    "Provider": "Dr. Bradley",
    "Refills": 11,
    "FillStatus": "Filled",
    "Route": "Oral",
    "Frequency": "Daily",
    "OrderStatus": "Complete",
    "Pharmacy": "CVS Pharmacy, 528 Beaver St, Durham, NC 27705"
  },
  {
    "Condition": "Hypertension",
    "DrugType": "Thiazide",
    "MedicationName": "Hydrochlorothiazide",
    "DosagePerDay": "50 mg",
    "Instructions": "Take one tablet of 50 mg/day for 30 days.",
    "Days": 365,
    "DateStarted": "2006-09-28",
    "Excel Start Date": "9/28/06",
    "Excel End Date": "9/28/07",
    "DateEnded": "2007-09-28",
    "Provider": "Dr. Bradley",
    "Refills": 11,
    "FillStatus": "Filled",
    "Route": "Oral",
    "Frequency": "Daily",
    "OrderStatus": "Complete",
    "Pharmacy": "CVS Pharmacy, 528 Beaver St, Durham, NC 27705"
  },
  {
    "Condition": "Hypertension",
    "DrugType": "Thiazide",
    "MedicationName": "Hydrochlorothiazide",
    "DosagePerDay": "50 mg",
    "Instructions": "Take one tablet of 50 mg/day for 30 days.",
    "Days": 365,
    "DateStarted": "2007-09-28",
    "Excel Start Date": "9/28/07",
    "Excel End Date": "9/27/08",
    "DateEnded": "2008-09-27",
    "Provider": "Dr. Bradley",
    "Refills": 11,
    "FillStatus": "Filled",
    "Route": "Oral",
    "Frequency": "Daily",
    "OrderStatus": "Complete",
    "Pharmacy": "CVS Pharmacy, 528 Beaver St, Durham, NC 27705"
  },
  {
    "Condition": "Hypertension",
    "DrugType": "Thiazide",
    "MedicationName": "Hydrochlorothiazide",
    "DosagePerDay": "50 mg",
    "Instructions": "Take one tablet of 50 mg/day for 30 days.",
    "Days": 365,
    "DateStarted": "2008-09-28",
    "Excel Start Date": "9/28/08",
    "Excel End Date": "9/28/09",
    "DateEnded": "2009-09-28",
    "Provider": "Dr. Bradley",
    "Refills": 11,
    "FillStatus": "Filled",
    "Route": "Oral",
    "Frequency": "Daily",
    "OrderStatus": "Complete",
    "Pharmacy": "CVS Pharmacy, 528 Beaver St, Durham, NC 27705"
  },
  {
    "Condition": "Hypertension",
    "DrugType": "Thiazide",
    "MedicationName": "Hydrochlorothiazide",
    "DosagePerDay": "50 mg",
    "Instructions": "Take one tablet of 50 mg/day for 30 days.",
    "Days": 365,
    "DateStarted": "2009-09-28",
    "Excel Start Date": "9/28/09",
    "Excel End Date": "9/28/10",
    "DateEnded": "2010-09-28",
    "Provider": "Dr. Bradley",
    "Refills": 11,
    "FillStatus": "Filled",
    "Route": "Oral",
    "Frequency": "Daily",
    "OrderStatus": "Complete",
    "Pharmacy": "CVS Pharmacy, 528 Beaver St, Durham, NC 27705"
  },
  {
    "Condition": "Hypertension",
    "DrugType": "Thiazide",
    "MedicationName": "Hydrochlorothiazide",
    "DosagePerDay": "50 mg",
    "Instructions": "Take one tablet of 50 mg/day for 30 days.",
    "Days": 365,
    "DateStarted": "2010-09-28",
    "Excel Start Date": "9/28/10",
    "Excel End Date": "9/28/11",
    "DateEnded": "2011-09-28",
    "Provider": "Dr. Bradley",
    "Refills": 11,
    "FillStatus": "Filled",
    "Route": "Oral",
    "Frequency": "Daily",
    "OrderStatus": "Complete",
    "Pharmacy": "CVS Pharmacy, 528 Beaver St, Durham, NC 27705"
  },
  {
    "Condition": "Hypertension",
    "DrugType": "Thiazide",
    "MedicationName": "Hydrochlorothiazide",
    "DosagePerDay": "50 mg",
    "Instructions": "Take one tablet of 50 mg/day for 30 days.",
    "Days": 365,
    "DateStarted": "2011-09-28",
    "Excel Start Date": "9/28/11",
    "Excel End Date": "9/27/12",
    "DateEnded": "2012-09-27",
    "Provider": "Dr. Bradley",
    "Refills": 11,
    "FillStatus": "Filled",
    "Route": "Oral",
    "Frequency": "Daily",
    "OrderStatus": "Complete",
    "Pharmacy": "CVS Pharmacy, 528 Beaver St, Durham, NC 27705"
  },
  {
    "Condition": "Hypertension",
    "DrugType": "Thiazide",
    "MedicationName": "Hydrochlorothiazide",
    "DosagePerDay": "50 mg",
    "Instructions": "Take one tablet of 50 mg/day for 30 days.",
    "Days": 365,
    "DateStarted": "2012-09-28",
    "Excel Start Date": "9/28/12",
    "Excel End Date": "9/28/13",
    "DateEnded": "2013-09-28",
    "Provider": "Dr. Bradley",
    "Refills": 11,
    "FillStatus": "Filled",
    "Route": "Oral",
    "Frequency": "Daily",
    "OrderStatus": "Complete",
    "Pharmacy": "CVS Pharmacy, 528 Beaver St, Durham, NC 27705"
  },
  {
    "Condition": "Hypertension",
    "DrugType": "Thiazide",
    "MedicationName": "Hydrochlorothiazide",
    "DosagePerDay": "50 mg",
    "Instructions": "Take one tablet of 50 mg/day for 30 days.",
    "Days": 365,
    "DateStarted": "2013-09-28",
    "Excel Start Date": "9/28/13",
    "Excel End Date": "9/28/14",
    "DateEnded": "2014-09-28",
    "Provider": "Dr. Bradley",
    "Refills": 11,
    "FillStatus": "Filled",
    "Route": "Oral",
    "Frequency": "Daily",
    "OrderStatus": "Complete",
    "Pharmacy": "CVS Pharmacy, 528 Beaver St, Durham, NC 27705"
  },
  {
    "Condition": "Hypertension",
    "DrugType": "Thiazide",
    "MedicationName": "Hydrochlorothiazide",
    "DosagePerDay": "50 mg",
    "Instructions": "Take one tablet of 50 mg/day for 30 days.",
    "Days": 365,
    "DateStarted": "2014-09-28",
    "Excel Start Date": "9/28/14",
    "Excel End Date": "9/28/15",
    "DateEnded": "2015-09-28",
    "Provider": "Dr. Bradley",
    "Refills": 11,
    "FillStatus": "Filled",
    "Route": "Oral",
    "Frequency": "Daily",
    "OrderStatus": "Complete",
    "Pharmacy": "CVS Pharmacy, 528 Beaver St, Durham, NC 27705"
  },
  {
    "Condition": "Hypertension",
    "DrugType": "Thiazide",
    "MedicationName": "Hydrochlorothiazide",
    "DosagePerDay": "50 mg",
    "Instructions": "Take one tablet of 50 mg/day for 30 days.",
    "Days": 365,
    "DateStarted": "2015-09-28",
    "Excel Start Date": "9/28/15",
    "Excel End Date": "9/27/16",
    "DateEnded": "2016-09-27",
    "Provider": "Dr. Bradley",
    "Refills": 11,
    "FillStatus": "Filled",
    "Route": "Oral",
    "Frequency": "Daily",
    "OrderStatus": "Complete",
    "Pharmacy": "CVS Pharmacy, 528 Beaver St, Durham, NC 27705"
  },
  {
    "Condition": "Hypertension",
    "DrugType": "ACE-I",
    "MedicationName": "Lisinopril",
    "DosagePerDay": "20 mg",
    "Instructions": "Take a 20 mg tablet/day for 30 days.",
    "Days": 30,
    "DateStarted": "2006-09-29",
    "Excel Start Date": "9/29/06",
    "Excel End Date": "10/29/06",
    "DateEnded": "2006-10-29",
    "Provider": "Dr. Bradley",
    "Refills": 0,
    "FillStatus": "Filled",
    "Route": "Oral",
    "Frequency": "Daily",
    "OrderStatus": "Complete",
    "Pharmacy": "CVS Pharmacy, 528 Beaver St, Durham, NC 27705"
  },
  {
    "Condition": "Hypertension",
    "DrugType": "ACE-I",
    "MedicationName": "Lisinopril",
    "DosagePerDay": "20 mg",
    "Instructions": "Take a 20 mg tablet/day for 30 days.",
    "Days": 180,
    "DateStarted": "2006-10-30",
    "Excel Start Date": "10/30/06",
    "Excel End Date": "4/28/07",
    "DateEnded": "2007-04-28",
    "Provider": "Dr. Bradley",
    "Refills": 5,
    "FillStatus": "Filled",
    "Route": "Oral",
    "Frequency": "Daily",
    "OrderStatus": "Complete",
    "Pharmacy": "CVS Pharmacy, 528 Beaver St, Durham, NC 27705"
  },
  {
    "Condition": "Hypertension",
    "DrugType": "ACE-I",
    "MedicationName": "Lisinopril",
    "DosagePerDay": "40 mg",
    "Instructions": "Take two 20 mg tablets for a total of 40mg/day for 30 days.",
    "Days": 30,
    "DateStarted": "2007-04-30",
    "Excel Start Date": "4/30/07",
    "Excel End Date": "5/30/07",
    "DateEnded": "2007-05-30",
    "Provider": "Dr. Bradley",
    "Refills": 0,
    "FillStatus": "Filled",
    "Route": "Oral",
    "Frequency": "Daily",
    "OrderStatus": "Complete",
    "Pharmacy": "CVS Pharmacy, 528 Beaver St, Durham, NC 27705"
  },
  {
    "Condition": "Hypertension",
    "DrugType": "ACE-I",
    "MedicationName": "Lisinopril",
    "DosagePerDay": "40 mg",
    "Instructions": "Take two 20 mg tablets for a total of 40mg/day for 30 days.",
    "Days": 365,
    "DateStarted": "2007-05-31",
    "Excel Start Date": "5/31/07",
    "Excel End Date": "5/30/08",
    "DateEnded": "2008-05-30",
    "Provider": "Dr. Bradley",
    "Refills": 11,
    "FillStatus": "Filled",
    "Route": "Oral",
    "Frequency": "Daily",
    "OrderStatus": "Complete",
    "Pharmacy": "CVS Pharmacy, 528 Beaver St, Durham, NC 27705"
  },
  {
    "Condition": "Hypertension",
    "DrugType": "ACE-I",
    "MedicationName": "Lisinopril",
    "DosagePerDay": "40 mg",
    "Instructions": "Take two 20 mg tablets for a total of 40mg/day for 30 days.",
    "Days": 365,
    "DateStarted": "2008-05-31",
    "Excel Start Date": "5/31/08",
    "Excel End Date": "5/31/09",
    "DateEnded": "2009-05-31",
    "Provider": "Dr. Bradley",
    "Refills": 11,
    "FillStatus": "Filled",
    "Route": "Oral",
    "Frequency": "Daily",
    "OrderStatus": "Complete",
    "Pharmacy": "CVS Pharmacy, 528 Beaver St, Durham, NC 27705"
  },
  {
    "Condition": "Hypertension",
    "DrugType": "ACE-I",
    "MedicationName": "Lisinopril",
    "DosagePerDay": "40 mg",
    "Instructions": "Take two 20 mg tablets for a total of 40mg/day for 30 days.",
    "Days": 365,
    "DateStarted": "2009-05-31",
    "Excel Start Date": "5/31/09",
    "Excel End Date": "5/31/10",
    "DateEnded": "2010-05-31",
    "Provider": "Dr. Bradley",
    "Refills": 11,
    "FillStatus": "Filled",
    "Route": "Oral",
    "Frequency": "Daily",
    "OrderStatus": "Complete",
    "Pharmacy": "CVS Pharmacy, 528 Beaver St, Durham, NC 27705"
  },
  {
    "Condition": "Hypertension",
    "DrugType": "ACE-I",
    "MedicationName": "Lisinopril",
    "DosagePerDay": "40 mg",
    "Instructions": "Take two 20 mg tablets for a total of 40mg/day for 30 days.",
    "Days": 365,
    "DateStarted": "2010-05-31",
    "Excel Start Date": "5/31/10",
    "Excel End Date": "5/31/11",
    "DateEnded": "2011-05-31",
    "Provider": "Dr. Bradley",
    "Refills": 11,
    "FillStatus": "Filled",
    "Route": "Oral",
    "Frequency": "Daily",
    "OrderStatus": "Complete",
    "Pharmacy": "CVS Pharmacy, 528 Beaver St, Durham, NC 27705"
  },
  {
    "Condition": "Hypertension",
    "DrugType": "ACE-I",
    "MedicationName": "Lisinopril",
    "DosagePerDay": "40 mg",
    "Instructions": "Take two 20 mg tablets for a total of 40mg/day for 30 days.",
    "Days": 365,
    "DateStarted": "2011-05-31",
    "Excel Start Date": "5/31/11",
    "Excel End Date": "5/30/12",
    "DateEnded": "2012-05-30",
    "Provider": "Dr. Bradley",
    "Refills": 11,
    "FillStatus": "Filled",
    "Route": "Oral",
    "Frequency": "Daily",
    "OrderStatus": "Complete",
    "Pharmacy": "CVS Pharmacy, 528 Beaver St, Durham, NC 27705"
  },
  {
    "Condition": "Hypertension",
    "DrugType": "ACE-I",
    "MedicationName": "Lisinopril",
    "DosagePerDay": "40 mg",
    "Instructions": "Take two 20 mg tablets for a total of 40mg/day for 30 days.",
    "Days": 365,
    "DateStarted": "2012-05-31",
    "Excel Start Date": "5/31/12",
    "Excel End Date": "5/31/13",
    "DateEnded": "2013-05-31",
    "Provider": "Dr. Bradley",
    "Refills": 11,
    "FillStatus": "Filled",
    "Route": "Oral",
    "Frequency": "Daily",
    "OrderStatus": "Complete",
    "Pharmacy": "CVS Pharmacy, 528 Beaver St, Durham, NC 27705"
  },
  {
    "Condition": "Hypertension",
    "DrugType": "ACE-I",
    "MedicationName": "Lisinopril",
    "DosagePerDay": "40 mg",
    "Instructions": "Take two 20 mg tablets for a total of 40mg/day for 30 days.",
    "Days": 365,
    "DateStarted": "2013-05-31",
    "Excel Start Date": "5/31/13",
    "Excel End Date": "5/31/14",
    "DateEnded": "2014-05-31",
    "Provider": "Dr. Bradley",
    "Refills": 11,
    "FillStatus": "Filled",
    "Route": "Oral",
    "Frequency": "Daily",
    "OrderStatus": "Complete",
    "Pharmacy": "CVS Pharmacy, 528 Beaver St, Durham, NC 27705"
  },
  {
    "Condition": "Hypertension",
    "DrugType": "ACE-I",
    "MedicationName": "Lisinopril",
    "DosagePerDay": "40 mg",
    "Instructions": "Take two 20 mg tablets for a total of 40mg/day for 30 days.",
    "Days": 365,
    "DateStarted": "2014-05-31",
    "Excel Start Date": "5/31/14",
    "Excel End Date": "5/31/15",
    "DateEnded": "2015-05-31",
    "Provider": "Dr. Bradley",
    "Refills": 11,
    "FillStatus": "Filled",
    "Route": "Oral",
    "Frequency": "Daily",
    "OrderStatus": "Complete",
    "Pharmacy": "CVS Pharmacy, 528 Beaver St, Durham, NC 27705"
  },
  {
    "Condition": "Hypertension",
    "DrugType": "ACE-I",
    "MedicationName": "Lisinopril",
    "DosagePerDay": "40 mg",
    "Instructions": "Take two 20 mg tablets for a total of 40mg/day for 30 days.",
    "Days": 365,
    "DateStarted": "2015-05-31",
    "Excel Start Date": "5/31/15",
    "Excel End Date": "5/30/16",
    "DateEnded": "2016-05-30",
    "Provider": "Dr. Bradley",
    "Refills": 11,
    "FillStatus": "Filled",
    "Route": "Oral",
    "Frequency": "Daily",
    "OrderStatus": "Complete",
    "Pharmacy": "CVS Pharmacy, 528 Beaver St, Durham, NC 27705"
  },
  {
    "Condition": "Hypertension",
    "DrugType": "ACE-I",
    "MedicationName": "Lisinopril",
    "DosagePerDay": "40 mg",
    "Instructions": "Take two 20 mg tablets for a total of 40mg/day for 30 days.",
    "Days": 365,
    "DateStarted": "2016-05-30",
    "Excel Start Date": "5/30/16",
    "Excel End Date": "5/30/17",
    "DateEnded": "2017-05-30",
    "Provider": "Dr. Bradley",
    "Refills": 11,
    "FillStatus": "Filled",
    "Route": "Oral",
    "Frequency": "Daily",
    "OrderStatus": "Complete",
    "Pharmacy": "CVS Pharmacy, 528 Beaver St, Durham, NC 27705"
  },
  {
    "Condition": "Hypertension",
    "DrugType": "CCB",
    "MedicationName": "Amlodipine",
    "DosagePerDay": "5 mg",
    "Instructions": "Take one 5 mg tablet/day for 30 days.",
    "Days": 30,
    "DateStarted": "2008-09-29",
    "Excel Start Date": "9/29/08",
    "Excel End Date": "10/29/08",
    "DateEnded": "2008-10-29",
    "Provider": "Dr. Bradley",
    "Refills": 0,
    "FillStatus": "Filled",
    "Route": "Oral",
    "Frequency": "Daily",
    "OrderStatus": "Complete",
    "Pharmacy": "CVS Pharmacy, 528 Beaver St, Durham, NC 27705"
  },
  {
    "Condition": "Hypertension",
    "DrugType": "CCB",
    "MedicationName": "Amlodipine",
    "DosagePerDay": "5 mg",
    "Instructions": "Take one 5 mg tablet/day for 30 days.",
    "Days": 180,
    "DateStarted": "2009-10-30",
    "Excel Start Date": "10/30/09",
    "Excel End Date": "4/28/10",
    "DateEnded": "2010-04-28",
    "Provider": "Dr. Bradley",
    "Refills": 5,
    "FillStatus": "Filled",
    "Route": "Oral",
    "Frequency": "Daily",
    "OrderStatus": "Complete",
    "Pharmacy": "CVS Pharmacy, 528 Beaver St, Durham, NC 27705"
  },
  {
    "Condition": "Hypertension",
    "DrugType": "CCB",
    "MedicationName": "Amlodipine",
    "DosagePerDay": "5 mg",
    "Instructions": "Take one 5 mg tablet/day for 30 days.",
    "Days": 365,
    "DateStarted": "2010-04-28",
    "Excel Start Date": "4/28/10",
    "Excel End Date": "4/28/11",
    "DateEnded": "2011-04-28",
    "Provider": "Dr. Bradley",
    "Refills": 11,
    "FillStatus": "Filled",
    "Route": "Oral",
    "Frequency": "Daily",
    "OrderStatus": "Complete",
    "Pharmacy": "CVS Pharmacy, 528 Beaver St, Durham, NC 27705"
  },
  {
    "Condition": "Hypertension",
    "DrugType": "CCB",
    "MedicationName": "Amlodipine",
    "DosagePerDay": "10 mg",
    "Instructions": "Take two 5 mg tablets for a total of 10 mg/day for 30 days.",
    "Days": 30,
    "DateStarted": "2011-04-29",
    "Excel Start Date": "4/29/11",
    "Excel End Date": "5/29/11",
    "DateEnded": "2011-05-29",
    "Provider": "Dr. Bradley",
    "Refills": 0,
    "FillStatus": "Filled",
    "Route": "Oral",
    "Frequency": "Daily",
    "OrderStatus": "Complete",
    "Pharmacy": "CVS Pharmacy, 528 Beaver St, Durham, NC 27705"
  },
  {
    "Condition": "Hypertension",
    "DrugType": "CCB",
    "MedicationName": "Amlodipine",
    "DosagePerDay": "10 mg",
    "Instructions": "Take two 5 mg tablets for a total of 10 mg/day for 30 days.",
    "Days": 365,
    "DateStarted": "2011-05-30",
    "Excel Start Date": "5/30/11",
    "Excel End Date": "5/29/12",
    "DateEnded": "2012-05-29",
    "Provider": "Dr. Bradley",
    "Refills": 11,
    "FillStatus": "Filled",
    "Route": "Oral",
    "Frequency": "Daily",
    "OrderStatus": "Complete",
    "Pharmacy": "CVS Pharmacy, 528 Beaver St, Durham, NC 27705"
  },
  {
    "Condition": "Hypertension",
    "DrugType": "CCB",
    "MedicationName": "Amlodipine",
    "DosagePerDay": "10 mg",
    "Instructions": "Take two 5 mg tablets for a total of 10 mg/day for 30 days.",
    "Days": 180,
    "DateStarted": "2012-05-30",
    "Excel Start Date": "5/30/12",
    "Excel End Date": "11/26/12",
    "DateEnded": "2012-11-27",
    "Provider": "Dr. Bradley",
    "Refills": 5,
    "FillStatus": "Filled",
    "Route": "Oral",
    "Frequency": "Daily",
    "OrderStatus": "Complete",
    "Pharmacy": "CVS Pharmacy, 528 Beaver St, Durham, NC 27705"
  },
  {
    "Condition": "Hypertension",
    "DrugType": "CCB",
    "MedicationName": "Amlodipine",
    "DosagePerDay": "10 mg",
    "Instructions": "Take two 5 mg tablets for a total of 10 mg/day for 30 days.",
    "Days": 180,
    "DateStarted": "2012-11-28",
    "Excel Start Date": "11/28/12",
    "Excel End Date": "5/27/13",
    "DateEnded": "2013-05-27",
    "Provider": "Dr. Bradley",
    "Refills": 5,
    "FillStatus": "Filled",
    "Route": "Oral",
    "Frequency": "Daily",
    "OrderStatus": "Complete",
    "Pharmacy": "CVS Pharmacy, 528 Beaver St, Durham, NC 27705"
  },
  {
    "Condition": "Hypertension",
    "DrugType": "CCB",
    "MedicationName": "Amlodipine",
    "DosagePerDay": "10 mg",
    "Instructions": "Take two 5 mg tablets for a total of 10 mg/day for 30 days.",
    "Days": 180,
    "DateStarted": "2013-05-28",
    "Excel Start Date": "5/28/13",
    "Excel End Date": "11/24/13",
    "DateEnded": "2014-11-24",
    "Provider": "Dr. Bradley",
    "Refills": 5,
    "FillStatus": "Filled",
    "Route": "Oral",
    "Frequency": "Daily",
    "OrderStatus": "Complete",
    "Pharmacy": "CVS Pharmacy, 528 Beaver St, Durham, NC 27705"
  },
  {
    "Condition": "Hypertension",
    "DrugType": "CCB",
    "MedicationName": "Amlodipine",
    "DosagePerDay": "10 mg",
    "Instructions": "Take two 5 mg tablets for a total of 10 mg/day for 30 days.",
    "Days": 180,
    "DateStarted": "2014-11-25",
    "Excel Start Date": "11/25/14",
    "Excel End Date": "5/24/15",
    "DateEnded": "2015-05-24",
    "Provider": "Dr. Bradley",
    "Refills": 5,
    "FillStatus": "Not filled",
    "Route": "Oral",
    "Frequency": "Daily",
    "OrderStatus": "Complete",
    "Pharmacy": "CVS Pharmacy, 528 Beaver St, Durham, NC 27705"
  },
  {
    "Condition": "Hypertension",
    "DrugType": "CCB",
    "MedicationName": "Amlodipine",
    "DosagePerDay": "10 mg",
    "Instructions": "Take two 5 mg tablets for a total of 10 mg/day for 30 days.",
    "Days": 365,
    "DateStarted": "2015-05-25",
    "Excel Start Date": "5/25/15",
    "Excel End Date": "5/24/16",
    "DateEnded": "2016-05-24",
    "Provider": "Dr. Bradley",
    "Refills": 11,
    "FillStatus": "Not filled",
    "Route": "Oral",
    "Frequency": "Daily",
    "OrderStatus": "Complete",
    "Pharmacy": "CVS Pharmacy, 528 Beaver St, Durham, NC 27705"
  },
  {
    "Condition": "Hypertension",
    "DrugType": "CCB",
    "MedicationName": "Amlodipine",
    "DosagePerDay": "10 mg",
    "Instructions": "Take two 5 mg tablets for a total of 10 mg/day for 30 days.",
    "Days": 365,
    "DateStarted": "2016-05-25",
    "Excel Start Date": "5/25/16",
    "Excel End Date": "5/25/17",
    "DateEnded": "2017-05-25",
    "Provider": "Dr. Bradley",
    "Refills": 11,
    "FillStatus": "Not filled",
    "Route": "Oral",
    "Frequency": "Daily",
    "OrderStatus": "Complete",
    "Pharmacy": "CVS Pharmacy, 528 Beaver St, Durham, NC 27705"
  },
  {
    "Condition": "Pneumonia",
    "DrugType": "Macrolide",
    "MedicationName": "Azithromycin",
    "DosagePerDay": "500 mg/ 250 mg",
    "Instructions": "Take one dose of 500 mg PO, then 250 mg PO for 4 days.",
    "Days": 5,
    "DateStarted": "2012-12-07",
    "Excel Start Date": "12/7/12",
    "Excel End Date": "12/12/12",
    "DateEnded": "2012-12-12",
    "Provider": "Dr. Emerman",
    "Refills": 0,
    "FillStatus": "Filled",
    "Route": "Oral",
    "Frequency": "Daily",
    "OrderStatus": "Complete",
    "Pharmacy": "CVS Pharmacy, 528 Beaver St, Durham, NC 27705"
  },
  {
    "Condition": "SCLC",
    "DrugType": "Alkylating agent",
    "MedicationName": "Cisplatin",
    "DosagePerDay": "120 mg",
    "Instructions": "Give 60mg/m2 IV on day 1 every 3 weeks for 4 cycles.",
    "Days": 21,
    "DateStarted": "2007-02-22",
    "Excel Start Date": "2/22/07",
    "Excel End Date": "3/15/07",
    "DateEnded": "2007-03-15",
    "Provider": "Dr. Searlman",
    "Refills": 0,
    "FillStatus": "Filled",
    "Route": "IV",
    "Frequency": "Per instructions",
    "OrderStatus": "Complete",
    "Pharmacy": "Duke Hospital Inpatient Unit"
  },
  {
    "Condition": "SCLC",
    "DrugType": "Alkylating agent",
    "MedicationName": "Cisplatin",
    "DosagePerDay": "120 mg",
    "Instructions": "Give 60mg/m2 IV on day 1 every 3 weeks for 4 cycles.",
    "Days": 21,
    "DateStarted": "2007-03-16",
    "Excel Start Date": "3/16/07",
    "Excel End Date": "4/6/07",
    "DateEnded": "2007-04-06",
    "Provider": "Dr. Searlman",
    "Refills": 0,
    "FillStatus": "Filled",
    "Route": "IV",
    "Frequency": "Per instructions",
    "OrderStatus": "Complete",
    "Pharmacy": "Duke Hospital Inpatient Unit"
  },
  {
    "Condition": "SCLC",
    "DrugType": "Alkylating agent",
    "MedicationName": "Cisplatin",
    "DosagePerDay": "120 mg",
    "Instructions": "Give 60mg/m2 IV on day 1 every 3 weeks for 4 cycles.",
    "Days": 21,
    "DateStarted": "2007-04-07",
    "Excel Start Date": "4/7/07",
    "Excel End Date": "4/28/07",
    "DateEnded": "2007-04-28",
    "Provider": "Dr. Searlman",
    "Refills": 0,
    "FillStatus": "Filled",
    "Route": "IV",
    "Frequency": "Per instructions",
    "OrderStatus": "Complete",
    "Pharmacy": "Duke Hospital Inpatient Unit"
  },
  {
    "Condition": "SCLC",
    "DrugType": "Alkylating agent",
    "MedicationName": "Cisplatin",
    "DosagePerDay": "120 mg",
    "Instructions": "Give 60mg/m2 IV on day 1 every 3 weeks for 4 cycles.",
    "Days": 21,
    "DateStarted": "2007-04-29",
    "Excel Start Date": "4/29/07",
    "Excel End Date": "5/20/07",
    "DateEnded": "2007-05-20",
    "Provider": "Dr. Searlman",
    "Refills": 0,
    "FillStatus": "Filled",
    "Route": "IV",
    "Frequency": "Per instructions",
    "OrderStatus": "Complete",
    "Pharmacy": "Duke Hospital Inpatient Unit"
  },
  {
    "Condition": "SCLC",
    "DrugType": "Topoisomerase II Inhibitor",
    "MedicationName": "Etoposide",
    "DosagePerDay": "200 mg",
    "Instructions": "Give 100 mg/m2/day IV on days 1, 2, and 3 every 3 weeks up to a maximum of 6 cycles.",
    "Days": 21,
    "DateStarted": "2007-02-22",
    "Excel Start Date": "2/22/07",
    "Excel End Date": "3/15/07",
    "DateEnded": "2007-03-15",
    "Provider": "Dr. Searlman",
    "Refills": 0,
    "FillStatus": "Filled",
    "Route": "IV",
    "Frequency": "Per instructions",
    "OrderStatus": "Complete",
    "Pharmacy": "Duke Hospital Inpatient Unit"
  },
  {
    "Condition": "SCLC",
    "DrugType": "Topoisomerase II Inhibitor",
    "MedicationName": "Etoposide",
    "DosagePerDay": "200 mg",
    "Instructions": "Give 100 mg/m2/day IV on days 1, 2, and 3 every 3 weeks up to a maximum of 6 cycles.",
    "Days": 21,
    "DateStarted": "2007-03-16",
    "Excel Start Date": "3/16/07",
    "Excel End Date": "4/6/07",
    "DateEnded": "2007-04-06",
    "Provider": "Dr. Searlman",
    "Refills": 0,
    "FillStatus": "Filled",
    "Route": "IV",
    "Frequency": "Per instructions",
    "OrderStatus": "Complete",
    "Pharmacy": "Duke Hospital Inpatient Unit"
  },
  {
    "Condition": "SCLC",
    "DrugType": "Topoisomerase II Inhibitor",
    "MedicationName": "Etoposide",
    "DosagePerDay": "200 mg",
    "Instructions": "Give 100 mg/m2/day IV on days 1, 2, and 3 every 3 weeks up to a maximum of 6 cycles.",
    "Days": 21,
    "DateStarted": "2007-04-07",
    "Excel Start Date": "4/7/07",
    "Excel End Date": "4/28/07",
    "DateEnded": "2007-04-28",
    "Provider": "Dr. Searlman",
    "Refills": 0,
    "FillStatus": "Filled",
    "Route": "IV",
    "Frequency": "Per instructions",
    "OrderStatus": "Complete",
    "Pharmacy": "Duke Hospital Inpatient Unit"
  },
  {
    "Condition": "SCLC",
    "DrugType": "Topoisomerase II Inhibitor",
    "MedicationName": "Etoposide",
    "DosagePerDay": "200 mg",
    "Instructions": "Give 100 mg/m2/day IV on days 1, 2, and 3 every 3 weeks up to a maximum of 6 cycles.",
    "Days": 21,
    "DateStarted": "2007-04-29",
    "Excel Start Date": "4/29/07",
    "Excel End Date": "5/20/07",
    "DateEnded": "2007-05-20",
    "Provider": "Dr. Searlman",
    "Refills": 0,
    "FillStatus": "Filled",
    "Route": "IV",
    "Frequency": "Per instructions",
    "OrderStatus": "Complete",
    "Pharmacy": "Duke Hospital Inpatient Unit"
  },
  {
    "Condition": "SCLC",
    "DrugType": "Topoisomerase II Inhibitor",
    "MedicationName": "Etoposide",
    "DosagePerDay": "200 mg",
    "Instructions": "Give 100 mg/m2/day IV on days 1, 2, and 3 every 3 weeks up to a maximum of 6 cycles.",
    "Days": 21,
    "DateStarted": "2007-05-21",
    "Excel Start Date": "5/21/07",
    "Excel End Date": "6/11/07",
    "DateEnded": "2007-06-11",
    "Provider": "Dr. Searlman",
    "Refills": 0,
    "FillStatus": "Filled",
    "Route": "IV",
    "Frequency": "Per instructions",
    "OrderStatus": "Complete",
    "Pharmacy": "Duke Hospital Inpatient Unit"
  },
  {
    "Condition": "SCLC",
    "DrugType": "Topoisomerase II Inhibitor",
    "MedicationName": "Etoposide",
    "DosagePerDay": "200 mg",
    "Instructions": "Give 100 mg/m2/day IV on days 1, 2, and 3 every 3 weeks up to a maximum of 6 cycles.",
    "Days": 21,
    "DateStarted": "2007-06-12",
    "Excel Start Date": "6/12/07",
    "Excel End Date": "7/3/07",
    "DateEnded": "2007-07-03",
    "Provider": "Dr. Searlman",
    "Refills": 0,
    "FillStatus": "Filled",
    "Route": "IV",
    "Frequency": "Per instructions",
    "OrderStatus": "Complete",
    "Pharmacy": "Duke Hospital Inpatient Unit"
  },
  {
    "Condition": "SCLC",
    "DrugType": "Alkylating agent",
    "MedicationName": "Carboplatin",
    "DosagePerDay": "570 mg",
    "Instructions": "Give target AUC 5 IV every 3 weeks (in combination with irinotecan) for 6 cycles.",
    "Days": 21,
    "DateStarted": "2008-07-04",
    "Excel Start Date": "7/4/08",
    "Excel End Date": "7/25/08",
    "DateEnded": "2008-07-25",
    "Provider": "Dr. Searlman",
    "Refills": 0,
    "FillStatus": "Filled",
    "Route": "IV",
    "Frequency": "Per instructions",
    "OrderStatus": "Complete",
    "Pharmacy": "Duke Hospital Inpatient Unit"
  },
  {
    "Condition": "SCLC",
    "DrugType": "Alkylating agent",
    "MedicationName": "Carboplatin",
    "DosagePerDay": "570 mg",
    "Instructions": "Give target AUC 5 IV every 3 weeks (in combination with irinotecan) for 6 cycles.",
    "Days": 21,
    "DateStarted": "2008-07-26",
    "Excel Start Date": "7/26/08",
    "Excel End Date": "8/16/08",
    "DateEnded": "2008-08-16",
    "Provider": "Dr. Searlman",
    "Refills": 0,
    "FillStatus": "Filled",
    "Route": "IV",
    "Frequency": "Per instructions",
    "OrderStatus": "Complete",
    "Pharmacy": "Duke Hospital Inpatient Unit"
  },
  {
    "Condition": "SCLC",
    "DrugType": "Alkylating agent",
    "MedicationName": "Carboplatin",
    "DosagePerDay": "570 mg",
    "Instructions": "Give target AUC 5 IV every 3 weeks (in combination with irinotecan) for 6 cycles.",
    "Days": 21,
    "DateStarted": "2008-08-17",
    "Excel Start Date": "8/17/08",
    "Excel End Date": "9/7/08",
    "DateEnded": "2008-09-07",
    "Provider": "Dr. Searlman",
    "Refills": 0,
    "FillStatus": "Filled",
    "Route": "IV",
    "Frequency": "Per instructions",
    "OrderStatus": "Complete",
    "Pharmacy": "Duke Hospital Inpatient Unit"
  },
  {
    "Condition": "SCLC",
    "DrugType": "Alkylating agent",
    "MedicationName": "Carboplatin",
    "DosagePerDay": "570 mg",
    "Instructions": "Give target AUC 5 IV every 3 weeks (in combination with irinotecan) for 6 cycles.",
    "Days": 21,
    "DateStarted": "2008-09-08",
    "Excel Start Date": "9/8/08",
    "Excel End Date": "9/29/08",
    "DateEnded": "2008-09-29",
    "Provider": "Dr. Searlman",
    "Refills": 0,
    "FillStatus": "Filled",
    "Route": "IV",
    "Frequency": "Per instructions",
    "OrderStatus": "Complete",
    "Pharmacy": "Duke Hospital Inpatient Unit"
  },
  {
    "Condition": "SCLC",
    "DrugType": "Alkylating agent",
    "MedicationName": "Carboplatin",
    "DosagePerDay": "570 mg",
    "Instructions": "Give target AUC 5 IV every 3 weeks (in combination with irinotecan) for 6 cycles.",
    "Days": 21,
    "DateStarted": "2008-09-30",
    "Excel Start Date": "9/30/08",
    "Excel End Date": "10/21/08",
    "DateEnded": "2008-10-21",
    "Provider": "Dr. Searlman",
    "Refills": 0,
    "FillStatus": "Filled",
    "Route": "IV",
    "Frequency": "Per instructions",
    "OrderStatus": "Complete",
    "Pharmacy": "Duke Hospital Inpatient Unit"
  },
  {
    "Condition": "SCLC",
    "DrugType": "Alkylating agent",
    "MedicationName": "Carboplatin",
    "DosagePerDay": "570 mg",
    "Instructions": "Give target AUC 5 IV every 3 weeks (in combination with irinotecan) for 6 cycles.",
    "Days": 21,
    "DateStarted": "2008-10-22",
    "Excel Start Date": "10/22/08",
    "Excel End Date": "11/12/08",
    "DateEnded": "2008-11-12",
    "Provider": "Dr. Searlman",
    "Refills": 0,
    "FillStatus": "Filled",
    "Route": "IV",
    "Frequency": "Per instructions",
    "OrderStatus": "Complete",
    "Pharmacy": "Duke Hospital Inpatient Unit"
  },
  {
    "Condition": "SCLC",
    "DrugType": "Topoisomerase I Inhibitor",
    "MedicationName": "Irinotecan",
    "DosagePerDay": "350 mg",
    "Instructions": "Give 175 mg/m2IV day 1 every 3 weeks (in combination with carboplatin)for 6 cycles.",
    "Days": 21,
    "DateStarted": "2008-07-04",
    "Excel Start Date": "7/4/08",
    "Excel End Date": "7/25/08",
    "DateEnded": "2008-07-25",
    "Provider": "Dr. Searlman",
    "Refills": 0,
    "FillStatus": "Filled",
    "Route": "",
    "Frequency": "",
    "OrderStatus": "Complete",
    "Pharmacy": "Duke Hospital Inpatient Unit"
  },
  {
    "Condition": "SCLC",
    "DrugType": "Topoisomerase I Inhibitor",
    "MedicationName": "Irinotecan",
    "DosagePerDay": "350 mg",
    "Instructions": "Give 175 mg/m2IV day 1 every 3 weeks (in combination with carboplatin)for 6 cycles.",
    "Days": 21,
    "DateStarted": "2008-07-26",
    "Excel Start Date": "7/26/08",
    "Excel End Date": "8/16/08",
    "DateEnded": "2008-08-16",
    "Provider": "Dr. Searlman",
    "Refills": 0,
    "FillStatus": "Filled",
    "Route": "",
    "Frequency": "",
    "OrderStatus": "Complete",
    "Pharmacy": "Duke Hospital Inpatient Unit"
  },
  {
    "Condition": "SCLC",
    "DrugType": "Topoisomerase I Inhibitor",
    "MedicationName": "Irinotecan",
    "DosagePerDay": "350 mg",
    "Instructions": "Give 175 mg/m2IV day 1 every 3 weeks (in combination with carboplatin)for 6 cycles.",
    "Days": 21,
    "DateStarted": "2008-08-17",
    "Excel Start Date": "8/17/08",
    "Excel End Date": "9/7/08",
    "DateEnded": "2008-09-07",
    "Provider": "Dr. Searlman",
    "Refills": 0,
    "FillStatus": "Filled",
    "Route": "",
    "Frequency": "",
    "OrderStatus": "Complete",
    "Pharmacy": "Duke Hospital Inpatient Unit"
  },
  {
    "Condition": "SCLC",
    "DrugType": "Topoisomerase I Inhibitor",
    "MedicationName": "Irinotecan",
    "DosagePerDay": "350 mg",
    "Instructions": "Give 175 mg/m2IV day 1 every 3 weeks (in combination with carboplatin)for 6 cycles.",
    "Days": 21,
    "DateStarted": "2008-09-08",
    "Excel Start Date": "9/8/08",
    "Excel End Date": "9/29/08",
    "DateEnded": "2008-09-29",
    "Provider": "Dr. Searlman",
    "Refills": 0,
    "FillStatus": "Filled",
    "Route": "",
    "Frequency": "",
    "OrderStatus": "Complete",
    "Pharmacy": "Duke Hospital Inpatient Unit"
  },
  {
    "Condition": "SCLC",
    "DrugType": "Topoisomerase I Inhibitor",
    "MedicationName": "Irinotecan",
    "DosagePerDay": "350 mg",
    "Instructions": "Give 175 mg/m2IV day 1 every 3 weeks (in combination with carboplatin)for 6 cycles.",
    "Days": 21,
    "DateStarted": "2008-09-30",
    "Excel Start Date": "9/30/08",
    "Excel End Date": "10/21/08",
    "DateEnded": "2008-10-21",
    "Provider": "Dr. Searlman",
    "Refills": 0,
    "FillStatus": "Filled",
    "Route": "",
    "Frequency": "",
    "OrderStatus": "Complete",
    "Pharmacy": "Duke Hospital Inpatient Unit"
  },
  {
    "Condition": "SCLC",
    "DrugType": "Topoisomerase I Inhibitor",
    "MedicationName": "Irinotecan",
    "DosagePerDay": "350 mg",
    "Instructions": "Give 175 mg/m2IV day 1 every 3 weeks (in combination with carboplatin)for 6 cycles.",
    "Days": 21,
    "DateStarted": "2008-10-22",
    "Excel Start Date": "10/22/08",
    "Excel End Date": "11/12/08",
    "DateEnded": "2008-11-12",
    "Provider": "Dr. Searlman",
    "Refills": 0,
    "FillStatus": "Filled",
    "Route": "",
    "Frequency": "",
    "OrderStatus": "Complete",
    "Pharmacy": "Duke Hospital Inpatient Unit"
  },
  {
    "Condition": "Nausea",
    "DrugType": "Serontonin receptor antagonist",
    "MedicationName": "Ondansetron",
    "DosagePerDay": "8 mg",
    "Instructions": "Take 8 mg beginning 30 minutes before chemotherapy; repeat dose 8 hours after initial dose, then 8 mg every 12 hours for 1 to 2 days after chemotherapy completed",
    "Days": 21,
    "DateStarted": "2007-02-22",
    "Excel Start Date": "2/22/07",
    "Excel End Date": "3/15/07",
    "DateEnded": "2007-03-15",
    "Provider": "Dr. Searlman",
    "Refills": 0,
    "FillStatus": "Filled",
    "Route": "Oral",
    "Frequency": "Per instructions",
    "OrderStatus": "Complete",
    "Pharmacy": "Duke Hospital Inpatient Unit"
  },
  {
    "Condition": "Nausea",
    "DrugType": "Serontonin receptor antagonist",
    "MedicationName": "Ondansetron",
    "DosagePerDay": "8 mg",
    "Instructions": "Take 8 mg beginning 30 minutes before chemotherapy; repeat dose 8 hours after initial dose, then 8 mg every 12 hours for 1 to 2 days after chemotherapy completed",
    "Days": 21,
    "DateStarted": "2007-03-16",
    "Excel Start Date": "3/16/07",
    "Excel End Date": "4/6/07",
    "DateEnded": "2007-04-06",
    "Provider": "Dr. Searlman",
    "Refills": 0,
    "FillStatus": "Filled",
    "Route": "Oral",
    "Frequency": "Per instructions",
    "OrderStatus": "Complete",
    "Pharmacy": "Duke Hospital Inpatient Unit"
  },
  {
    "Condition": "Nausea",
    "DrugType": "Serontonin receptor antagonist",
    "MedicationName": "Ondansetron",
    "DosagePerDay": "8 mg",
    "Instructions": "Take 8 mg beginning 30 minutes before chemotherapy; repeat dose 8 hours after initial dose, then 8 mg every 12 hours for 1 to 2 days after chemotherapy completed",
    "Days": 21,
    "DateStarted": "2007-04-07",
    "Excel Start Date": "4/7/07",
    "Excel End Date": "4/28/07",
    "DateEnded": "2007-04-28",
    "Provider": "Dr. Searlman",
    "Refills": 0,
    "FillStatus": "Filled",
    "Route": "Oral",
    "Frequency": "Per instructions",
    "OrderStatus": "Complete",
    "Pharmacy": "Duke Hospital Inpatient Unit"
  },
  {
    "Condition": "Nausea",
    "DrugType": "Serontonin receptor antagonist",
    "MedicationName": "Ondansetron",
    "DosagePerDay": "8 mg",
    "Instructions": "Take 8 mg beginning 30 minutes before chemotherapy; repeat dose 8 hours after initial dose, then 8 mg every 12 hours for 1 to 2 days after chemotherapy completed",
    "Days": 21,
    "DateStarted": "2007-04-29",
    "Excel Start Date": "4/29/07",
    "Excel End Date": "5/20/07",
    "DateEnded": "2007-05-20",
    "Provider": "Dr. Searlman",
    "Refills": 0,
    "FillStatus": "Filled",
    "Route": "Oral",
    "Frequency": "Per instructions",
    "OrderStatus": "Complete",
    "Pharmacy": "Duke Hospital Inpatient Unit"
  },
  {
    "Condition": "Nausea",
    "DrugType": "Serontonin receptor antagonist",
    "MedicationName": "Ondansetron",
    "DosagePerDay": "8 mg",
    "Instructions": "Take 8 mg beginning 30 minutes before chemotherapy; repeat dose 8 hours after initial dose, then 8 mg every 12 hours for 1 to 2 days after chemotherapy completed",
    "Days": 21,
    "DateStarted": "2007-05-21",
    "Excel Start Date": "5/21/07",
    "Excel End Date": "6/11/07",
    "DateEnded": "2007-06-11",
    "Provider": "Dr. Searlman",
    "Refills": 0,
    "FillStatus": "Filled",
    "Route": "Oral",
    "Frequency": "Per instructions",
    "OrderStatus": "Complete",
    "Pharmacy": "Duke Hospital Inpatient Unit"
  },
  {
    "Condition": "Nausea",
    "DrugType": "Serontonin receptor antagonist",
    "MedicationName": "Ondansetron",
    "DosagePerDay": "8 mg",
    "Instructions": "Take 8 mg beginning 30 minutes before chemotherapy; repeat dose 8 hours after initial dose, then 8 mg every 12 hours for 1 to 2 days after chemotherapy completed",
    "Days": 21,
    "DateStarted": "2007-06-12",
    "Excel Start Date": "6/12/07",
    "Excel End Date": "7/3/07",
    "DateEnded": "2007-07-03",
    "Provider": "Dr. Searlman",
    "Refills": 0,
    "FillStatus": "Filled",
    "Route": "Oral",
    "Frequency": "Per instructions",
    "OrderStatus": "Complete",
    "Pharmacy": "Duke Hospital Inpatient Unit"
  },
  {
    "Condition": "Nausea",
    "DrugType": "Serontonin receptor antagonist",
    "MedicationName": "Ondansetron",
    "DosagePerDay": "8 mg",
    "Instructions": "Take 8 mg beginning 30 minutes before chemotherapy; repeat dose 8 hours after initial dose, then 8 mg every 12 hours for 1 to 2 days after chemotherapy completed",
    "Days": 21,
    "DateStarted": "2008-07-04",
    "Excel Start Date": "7/4/08",
    "Excel End Date": "7/25/08",
    "DateEnded": "2008-07-25",
    "Provider": "Dr. Searlman",
    "Refills": 0,
    "FillStatus": "Filled",
    "Route": "Oral",
    "Frequency": "Per instructions",
    "OrderStatus": "Complete",
    "Pharmacy": "Duke Hospital Inpatient Unit"
  },
  {
    "Condition": "Nausea",
    "DrugType": "Serontonin receptor antagonist",
    "MedicationName": "Ondansetron",
    "DosagePerDay": "8 mg",
    "Instructions": "Take 8 mg beginning 30 minutes before chemotherapy; repeat dose 8 hours after initial dose, then 8 mg every 12 hours for 1 to 2 days after chemotherapy completed",
    "Days": 21,
    "DateStarted": "2008-07-26",
    "Excel Start Date": "7/26/08",
    "Excel End Date": "8/16/08",
    "DateEnded": "2008-08-16",
    "Provider": "Dr. Searlman",
    "Refills": 0,
    "FillStatus": "Filled",
    "Route": "Oral",
    "Frequency": "Per instructions",
    "OrderStatus": "Complete",
    "Pharmacy": "Duke Hospital Inpatient Unit"
  },
  {
    "Condition": "Nausea",
    "DrugType": "Serontonin receptor antagonist",
    "MedicationName": "Ondansetron",
    "DosagePerDay": "8 mg",
    "Instructions": "Take 8 mg beginning 30 minutes before chemotherapy; repeat dose 8 hours after initial dose, then 8 mg every 12 hours for 1 to 2 days after chemotherapy completed",
    "Days": 21,
    "DateStarted": "2008-08-17",
    "Excel Start Date": "8/17/08",
    "Excel End Date": "9/7/08",
    "DateEnded": "2008-09-07",
    "Provider": "Dr. Searlman",
    "Refills": 0,
    "FillStatus": "Filled",
    "Route": "Oral",
    "Frequency": "Per instructions",
    "OrderStatus": "Complete",
    "Pharmacy": "Duke Hospital Inpatient Unit"
  },
  {
    "Condition": "Nausea",
    "DrugType": "Serontonin receptor antagonist",
    "MedicationName": "Ondansetron",
    "DosagePerDay": "8 mg",
    "Instructions": "Take 8 mg beginning 30 minutes before chemotherapy; repeat dose 8 hours after initial dose, then 8 mg every 12 hours for 1 to 2 days after chemotherapy completed",
    "Days": 21,
    "DateStarted": "2008-09-08",
    "Excel Start Date": "9/8/08",
    "Excel End Date": "9/29/08",
    "DateEnded": "2008-09-29",
    "Provider": "Dr. Searlman",
    "Refills": 0,
    "FillStatus": "Filled",
    "Route": "Oral",
    "Frequency": "Per instructions",
    "OrderStatus": "Complete",
    "Pharmacy": "Duke Hospital Inpatient Unit"
  },
  {
    "Condition": "Nausea",
    "DrugType": "Serontonin receptor antagonist",
    "MedicationName": "Ondansetron",
    "DosagePerDay": "8 mg",
    "Instructions": "Take 8 mg beginning 30 minutes before chemotherapy; repeat dose 8 hours after initial dose, then 8 mg every 12 hours for 1 to 2 days after chemotherapy completed",
    "Days": 21,
    "DateStarted": "2008-09-30",
    "Excel Start Date": "9/30/08",
    "Excel End Date": "10/21/08",
    "DateEnded": "2008-10-21",
    "Provider": "Dr. Searlman",
    "Refills": 0,
    "FillStatus": "Filled",
    "Route": "Oral",
    "Frequency": "Per instructions",
    "OrderStatus": "Complete",
    "Pharmacy": "Duke Hospital Inpatient Unit"
  },
  {
    "Condition": "Nausea",
    "DrugType": "Serontonin receptor antagonist",
    "MedicationName": "Ondansetron",
    "DosagePerDay": "8 mg",
    "Instructions": "Take 8 mg beginning 30 minutes before chemotherapy; repeat dose 8 hours after initial dose, then 8 mg every 12 hours for 1 to 2 days after chemotherapy completed",
    "Days": 21,
    "DateStarted": "2008-10-22",
    "Excel Start Date": "10/22/08",
    "Excel End Date": "11/12/08",
    "DateEnded": "2008-11-12",
    "Provider": "Dr. Searlman",
    "Refills": 0,
    "FillStatus": "Filled",
    "Route": "Oral",
    "Frequency": "Per instructions",
    "OrderStatus": "Complete",
    "Pharmacy": "Duke Hospital Inpatient Unit"
  },
  {
    "Condition": "Nausea",
    "DrugType": "Dopamine receptor antagonist",
    "MedicationName": "Metoclopromide",
    "DosagePerDay": "80 mg",
    "Instructions": "1 mg/kg over 15 minutes 30 minutes before chemotherapy; repeat every 2 hours for 2 doses, then every 3 hours for 3 doses",
    "Days": 21,
    "DateStarted": "2007-02-22",
    "Excel Start Date": "2/22/07",
    "Excel End Date": "3/15/07",
    "DateEnded": "2007-03-15",
    "Provider": "Dr. Searlman",
    "Refills": 0,
    "FillStatus": "Filled",
    "Route": "Oral",
    "Frequency": "Per instructions",
    "OrderStatus": "Complete",
    "Pharmacy": "Duke Hospital Inpatient Unit"
  },
  {
    "Condition": "Nausea",
    "DrugType": "Dopamine receptor antagonist",
    "MedicationName": "Metoclopromide",
    "DosagePerDay": "80 mg",
    "Instructions": "1 mg/kg over 15 minutes 30 minutes before chemotherapy; repeat every 2 hours for 2 doses, then every 3 hours for 3 doses",
    "Days": 21,
    "DateStarted": "2007-03-16",
    "Excel Start Date": "3/16/07",
    "Excel End Date": "4/6/07",
    "DateEnded": "2007-04-06",
    "Provider": "Dr. Searlman",
    "Refills": 0,
    "FillStatus": "Filled",
    "Route": "Oral",
    "Frequency": "Per instructions",
    "OrderStatus": "Complete",
    "Pharmacy": "Duke Hospital Inpatient Unit"
  },
  {
    "Condition": "Nausea",
    "DrugType": "Dopamine receptor antagonist",
    "MedicationName": "Metoclopromide",
    "DosagePerDay": "80 mg",
    "Instructions": "1 mg/kg over 15 minutes 30 minutes before chemotherapy; repeat every 2 hours for 2 doses, then every 3 hours for 3 doses",
    "Days": 21,
    "DateStarted": "2007-04-07",
    "Excel Start Date": "4/7/07",
    "Excel End Date": "4/28/07",
    "DateEnded": "2007-04-28",
    "Provider": "Dr. Searlman",
    "Refills": 0,
    "FillStatus": "Filled",
    "Route": "Oral",
    "Frequency": "Per instructions",
    "OrderStatus": "Complete",
    "Pharmacy": "Duke Hospital Inpatient Unit"
  },
  {
    "Condition": "Nausea",
    "DrugType": "Dopamine receptor antagonist",
    "MedicationName": "Metoclopromide",
    "DosagePerDay": "80 mg",
    "Instructions": "1 mg/kg over 15 minutes 30 minutes before chemotherapy; repeat every 2 hours for 2 doses, then every 3 hours for 3 doses",
    "Days": 21,
    "DateStarted": "2007-04-29",
    "Excel Start Date": "4/29/07",
    "Excel End Date": "5/20/07",
    "DateEnded": "2007-05-20",
    "Provider": "Dr. Searlman",
    "Refills": 0,
    "FillStatus": "Filled",
    "Route": "Oral",
    "Frequency": "Per instructions",
    "OrderStatus": "Complete",
    "Pharmacy": "Duke Hospital Inpatient Unit"
  },
  {
    "Condition": "Nausea",
    "DrugType": "Dopamine receptor antagonist",
    "MedicationName": "Metoclopromide",
    "DosagePerDay": "80 mg",
    "Instructions": "1 mg/kg over 15 minutes 30 minutes before chemotherapy; repeat every 2 hours for 2 doses, then every 3 hours for 3 doses",
    "Days": 21,
    "DateStarted": "2007-05-21",
    "Excel Start Date": "5/21/07",
    "Excel End Date": "6/11/07",
    "DateEnded": "2007-06-11",
    "Provider": "Dr. Searlman",
    "Refills": 0,
    "FillStatus": "Filled",
    "Route": "Oral",
    "Frequency": "Per instructions",
    "OrderStatus": "Complete",
    "Pharmacy": "Duke Hospital Inpatient Unit"
  },
  {
    "Condition": "Nausea",
    "DrugType": "Dopamine receptor antagonist",
    "MedicationName": "Metoclopromide",
    "DosagePerDay": "80 mg",
    "Instructions": "1 mg/kg over 15 minutes 30 minutes before chemotherapy; repeat every 2 hours for 2 doses, then every 3 hours for 3 doses",
    "Days": 21,
    "DateStarted": "2007-06-12",
    "Excel Start Date": "6/12/07",
    "Excel End Date": "7/3/07",
    "DateEnded": "2007-07-03",
    "Provider": "Dr. Searlman",
    "Refills": 0,
    "FillStatus": "Filled",
    "Route": "Oral",
    "Frequency": "Per instructions",
    "OrderStatus": "Complete",
    "Pharmacy": "Duke Hospital Inpatient Unit"
  },
  {
    "Condition": "Nausea",
    "DrugType": "Dopamine receptor antagonist",
    "MedicationName": "Metoclopromide",
    "DosagePerDay": "80 mg",
    "Instructions": "1 mg/kg over 15 minutes 30 minutes before chemotherapy; repeat every 2 hours for 2 doses, then every 3 hours for 3 doses",
    "Days": 21,
    "DateStarted": "2008-07-04",
    "Excel Start Date": "7/4/08",
    "Excel End Date": "7/25/08",
    "DateEnded": "2008-07-25",
    "Provider": "Dr. Searlman",
    "Refills": 0,
    "FillStatus": "Filled",
    "Route": "Oral",
    "Frequency": "Per instructions",
    "OrderStatus": "Complete",
    "Pharmacy": "Duke Hospital Inpatient Unit"
  },
  {
    "Condition": "Nausea",
    "DrugType": "Dopamine receptor antagonist",
    "MedicationName": "Metoclopromide",
    "DosagePerDay": "80 mg",
    "Instructions": "1 mg/kg over 15 minutes 30 minutes before chemotherapy; repeat every 2 hours for 2 doses, then every 3 hours for 3 doses",
    "Days": 21,
    "DateStarted": "2008-07-26",
    "Excel Start Date": "7/26/08",
    "Excel End Date": "8/16/08",
    "DateEnded": "2008-08-16",
    "Provider": "Dr. Searlman",
    "Refills": 0,
    "FillStatus": "Filled",
    "Route": "Oral",
    "Frequency": "Per instructions",
    "OrderStatus": "Complete",
    "Pharmacy": "Duke Hospital Inpatient Unit"
  },
  {
    "Condition": "Nausea",
    "DrugType": "Dopamine receptor antagonist",
    "MedicationName": "Metoclopromide",
    "DosagePerDay": "80 mg",
    "Instructions": "1 mg/kg over 15 minutes 30 minutes before chemotherapy; repeat every 2 hours for 2 doses, then every 3 hours for 3 doses",
    "Days": 21,
    "DateStarted": "2008-08-17",
    "Excel Start Date": "8/17/08",
    "Excel End Date": "9/7/08",
    "DateEnded": "2008-09-07",
    "Provider": "Dr. Searlman",
    "Refills": 0,
    "FillStatus": "Filled",
    "Route": "Oral",
    "Frequency": "Per instructions",
    "OrderStatus": "Complete",
    "Pharmacy": "Duke Hospital Inpatient Unit"
  },
  {
    "Condition": "Nausea",
    "DrugType": "Dopamine receptor antagonist",
    "MedicationName": "Metoclopromide",
    "DosagePerDay": "80 mg",
    "Instructions": "1 mg/kg over 15 minutes 30 minutes before chemotherapy; repeat every 2 hours for 2 doses, then every 3 hours for 3 doses",
    "Days": 21,
    "DateStarted": "2008-09-08",
    "Excel Start Date": "9/8/08",
    "Excel End Date": "9/29/08",
    "DateEnded": "2008-09-29",
    "Provider": "Dr. Searlman",
    "Refills": 0,
    "FillStatus": "Filled",
    "Route": "Oral",
    "Frequency": "Per instructions",
    "OrderStatus": "Complete",
    "Pharmacy": "Duke Hospital Inpatient Unit"
  },
  {
    "Condition": "Nausea",
    "DrugType": "Dopamine receptor antagonist",
    "MedicationName": "Metoclopromide",
    "DosagePerDay": "80 mg",
    "Instructions": "1 mg/kg over 15 minutes 30 minutes before chemotherapy; repeat every 2 hours for 2 doses, then every 3 hours for 3 doses",
    "Days": 21,
    "DateStarted": "2008-09-30",
    "Excel Start Date": "9/30/08",
    "Excel End Date": "10/21/08",
    "DateEnded": "2008-10-21",
    "Provider": "Dr. Searlman",
    "Refills": 0,
    "FillStatus": "Filled",
    "Route": "Oral",
    "Frequency": "Per instructions",
    "OrderStatus": "Complete",
    "Pharmacy": "Duke Hospital Inpatient Unit"
  },
  {
    "Condition": "Nausea",
    "DrugType": "Dopamine receptor antagonist",
    "MedicationName": "Metoclopromide",
    "DosagePerDay": "80 mg",
    "Instructions": "1 mg/kg over 15 minutes 30 minutes before chemotherapy; repeat every 2 hours for 2 doses, then every 3 hours for 3 doses",
    "Days": 21,
    "DateStarted": "2008-10-22",
    "Excel Start Date": "10/22/08",
    "Excel End Date": "11/12/08",
    "DateEnded": "2008-11-12",
    "Provider": "Dr. Searlman",
    "Refills": 0,
    "FillStatus": "Filled",
    "Route": "Oral",
    "Frequency": "Per instructions",
    "OrderStatus": "Complete",
    "Pharmacy": "Duke Hospital Inpatient Unit"
  }
]
